,Date,Snippet
0,20180829,"Quotation of the Day for Thursday, August 30, 2018."
1,20180829,Egypt’s soccer superstar Mohamed Salah unleashed a fierce assault on the country’s sporting establishment — an unusual act in a country where dissent is dangerous.
2,20180829,A massive swarm of bees gathered on a hot dog cart umbrella in New York City's Times Square on Monday. Before long it became a social media sensation thanks to live footage from Reuters. 
3,20180829,Trump’s magical mixture is to make being afraid feel like fun. 
4,20180829,Top executives at Facebook and Twitter are set to appear before Congress next week as lawmakers continue probing efforts by Russia and other countries to influence social media platforms and meddle in U.S. elections.
5,20180829,"A 10-person task force has been set up to try to catch the person responsible for mutilating and killing at least 12 cats in and near Olympia, Wash., since February."
6,20180829,A comedian who admitted to sexual misconduct seems to think it’s time for his comeback.
7,20180829,"The Senate intelligence committee said on Wednesday it would hold a hearing next week to look at how social media companies are responding to foreign influence operations, with testimony expected from top executives of Twitter Inc, Facebook Inc an..."
8,20180829,"The president, who has condoned violence at his rallies, says Democrats will “violently” overturn all he has done if they prevail in the midterms."
9,20180829,"A publishing saga, captured in Potter ephemera — letters, sketches, mementos and more — that has been transfigured into treasure."
10,20180829,North Carolina police have charged two women with helping three children smoke an apparently drug-laced cigar on social media video.
11,20180829,"Wednesday: Passenger aircraft that can fly on its own, the state fully abolishes cash bail, and an odd avocado toast recipe."
12,20180829,"Social media, including Facebook, must proactively block content inciting hatred and prevent online campaigns which target minorities, such as those undertaken in Myanmar, the United Nations human rights chief said on Wednesday."
13,20180829,Primary season is almost over. It’s been a good one for people who want to hold Trump accountable.
14,20180829,"Justicia ‘familiar’ en México, felicidad artificial y plantas nucleares flotantes: lo que está sucediendo en América Latina y en el mundo."
15,20180829,Facebook is rolling out its Watch video service globally one year after it launched in the United States with original entertainment news and sports content to compete with platforms like Alphabet Inc's YouTube.
16,20180829,"Wednesday: What actors-turned-politicians bring to the table, and a new NYC Ferry route."
17,20180829,The state should help preserve rain forests through its cap and trade system for reducing greenhouse gas emissions.
18,20180829,It’s time for a national commitment to training and supporting the next generation of providers.
19,20180829,Our system is designed to make it almost impossible to consider the domestic collateral damage of trade sanctions.
20,20180828,"She inhabited some of the most daunting roles in the operatic repertoire and was best known for her depictions of two Strauss heroines, Salome and Elektra."
21,20180828,The death of the runner Mollie Tibbetts has ignited a national conversation about the harassment and fears women face every time they go for a run.
22,20180828,Australia’s cultural and creative heart is a tech boomtown. Here’s why the world should take notice.
23,20180828,"The death of the Arizona senator has deprived Moscow of its favorite punching bag, the supposed leader of a global conspiracy of “Russophobes.”"
24,20180828,"With two new openings, Billy Durney of Hometown Bar-B-Que is shifting his attention to fried chicken and Jewish deli favorites."
25,20180828,"In fly pupae that turned to stone, scientists found evidence that wasps have been infesting other insects for tens of millions of years."
26,20180828,"If your child is just off to college and you've been dreaming of all the ways you could use that suddenly lifeless bedroom, you may want to put down the paintbrush and hold off for a bit on plans for a major room transformation."
27,20180828,The Latest on President Donald Trump's complaints about tech companies (all times local):
28,20180828,"Recreation, a hotel bar coming to the financial district, is part of a new drinks culture that includes retro family fun."
29,20180828,The Latest on the mass shooting at a Florida video gaming tournament (all times local):
30,20180827,A large study of drinking habits in 195 countries contradicts widely shared advice on healthy drinking.
31,20180827,"The White House lowered its U.S. flag to half-staff, raised it back up and on Monday lowered it again after the death of Senator John McCain, in an unusual and confusing break with protocol on the passing of a national leader."
32,20180827,The scandal that started with a former Argentine official stashing cash in a convent and deepened when records of alleged bribe payments were published took new turn on Monday with accusations by a lawyer for former President Cristina Fernandez th...
33,20180827,The genetic mechanisms that seem to influence human life span may also be at work in plants. 
34,20180827,The latest short jail term for the opposition leader comes before expected demonstrations against an unpopular plan to raise the retirement age in Russia.
35,20180827,But enough about John McCain. Here’s some more about me. 
36,20180827,Some fall arrivals will bolster the city’s rich array of slurp-worthy restaurants.
37,20180827,"Ian Schrager, who has a long roster of big-name cooks, will add John Fraser to the list at his new Times Square hotel."
38,20180827,The neighborhood’s fall openings may help shake its reputation as a dining dead zone.
39,20180827,One of the most highly anticipated segments of Sacha Baron Cohen’s Showtime series — an interview with Sarah Palin — never aired. It’s unclear why.
40,20180827,"One of the internet’s most popular fitness personalities is a dead bodybuilder named Zyzz. Is he the key to unlocking the link between toxic masculinity, objectification, and fringe politics?"
41,20180827,"Away from the uptown empire, a son of Eli Zabar will open his own restaurant on the Lower East Side."
42,20180827,"Each week we select an engaging Times graph and pair it with a simple protocol — asking students what they notice, what they wonder, and what they think is going on in the graph."
43,20180827,"Mohamed Salah has reignited a months-old dispute with soccer authorities in his native Egypt, accusing them of ignoring his complaints about their unauthorized use of his image."
44,20180827,"A United Nations panel says that Myanmar’s top general, Min Aung Hlaing, should be among those tried for a “plan for destruction” of Rohingya Muslims."
45,20180827,"John G. Zimmerman's photos of Arthur Ashe, the first black man to win a singles title at the United States Open, represented the athlete as he lived: a complex and self-possessed man in the midst of a life-altering event."
46,20180827,"Myanmar's military carried out mass killings and gang rapes of Muslim Rohingya with ""genocidal intent"", and the commander-in-chief and five generals should be prosecuted for the gravest crimes under international law, United Nations investigators ..."
47,20180827,"The e-cigarette company says it never sought teenage users, but the F.D.A. is investigating whether Juul intentionally marketed its devices to youth."
48,20180827,Sen. John McCain's death in office has handed Arizona's governor an empty Senate seat to give out &#8212; and a difficult political puzzle to solve before he does.
49,20180827,The education secretary is working hard to protect the scandal-ridden for-profit education industry from accountability. 
50,20180825,"Thousands of Rohingya Muslim were believed killed, and hundreds of thousands driven out of Myanmar in a military-led campaign of ethnic cleansing, but top officers have escaped any consequences."
51,20180825,A former Cambodian opposition lawmaker who has been a strong critic of the government's handling of demarcating the border with neighboring Vietnam has been pardoned by the country's king.
52,20180825,"The conventional wisdom is that morning people are high achievers, go-getters, while late risers are lazy. But what if going to bed in the wee hours is actually an advantage?"
53,20180825,"Living among us are hundreds of fairy gardeners, who maintain a sense of childlike wonder and whimsy by embracing miniature gardening with fairies, gnomes and other mythical figurines."
54,20180825,Empathy is at the core of who we are. That can be painful. 
55,20180825,Abuse survivors and their advocates around the world were closely watching what the pope said about the crisis that has undermined the church around the world.
56,20180825,The thing with every shocking revelation about Trump is that it's already baked into his image. I've never met a Trump supporter who did not know exactly who he is.
57,20180825,Politics 2018: the wives under the bus.
58,20180825,"Like many who slip across the border, Cristhian Bahena Rivera left almost no official trace. Then he was charged with the murder of a college student."
59,20180825,It has been a year since the hurricane devastated our city — and more rain will come soon.
60,20180824,"Italy's populist government said on Friday it would cut funds for the European Union unless other states take in boat migrants stranded in an Italian port, earning a rebuke from Brussels for making unacceptable ""threats""."
61,20180824,"U.S. President Donald Trump accused social media companies on Friday of silencing ""millions of people"" in an act of censorship, but without offering evidence to support the claim."
62,20180824,Indonesia's biggest Islamic organization called for greater tolerance on Friday as it criticized a court that jailed a mother of four for blasphemy after complaining that a mosque in her neighborhood was too loud.
63,20180824,Figuring out the numbers required to remove the automaker from the stock markets is complex — and perhaps even unmoored from reality.
64,20180824,"In a story Aug. 24 about a Palestinian nurse involved in an attack against Israeli forces, The Associated Press reported erroneously that his employer, Doctors Without Borders, said he had been killed by Israeli troops. The group says he was kille..."
65,20180824,The Assad government is not going away soon. But the killing has to stop.
66,20180824,Friday: Remembering a music man and your favorite things about fall.
67,20180824,"The issues that drove protesters to Chicago in 1968 are still motivating our partisan divide, 50 years later."
68,20180824,"The abuse already common in many women’s everyday lives can be amplified in political campaigns, especially if the candidate is also a member of a minority group."
69,20180824,The subscription-based hyperlocal sports website and app is growing quicker than any sports media company in recent memory. But can its expansion be sustained?
70,20180823,The Latest on tech companies and election interference (all times local):
71,20180823,Alphabet Inc's Google said on Thursday it had identified and terminated 39 YouTube channels linked to state-run Islamic Republic of Iran Broadcasting.
72,20180823,"The accounts were linked to the state broadcaster, the company said. The news followed similar moves by Facebook and Twitter."
73,20180823,The Food and Drug Administration had targeted 17 makers and sellers of items loaded with nicotine in packaging that could appeal to children.
74,20180823,Israel said on Thursday that a Palestinian gunman killed by its forces on the Gaza Strip border this week was a nurse working for Medecins Sans Frontieres (Doctors Without Borders) and that it was seeking an explanation from the international aid ...
75,20180823,Activists have called for prosecutors to investigate the stabbing of a 24-year-old black man outside a Pittsburgh bar as a hate crime after video emerged of the white suspect using a racial epithet.
76,20180823,Catholics should not keep on filling the pews every Sunday. It is wrong to support the church.
77,20180823,The U.S. Navy says it is calling off its search for a sailor reported lost at sea earlier this week in the eastern Pacific Ocean.
78,20180823,Italian Deputy Prime Minister Luigi Di Maio said on Thursday his party would vote to suspend funding to the European Union next year unless other states agreed to take in migrants being held on a coastguard ship in Sicily.
79,20180823,"Maybe, but you could try giving him some space and apologizing."
80,20180823,"Cambodian Prime Minister Hun Sen said Thursday that he is considering a ""huge amnesty"" for prisoners so that those released will have a chance to correct their mistakes."
81,20180823,A reader finds that it’s easy to connect with people who are different. We just have to listen to each other. 
82,20180823,Here’s what you need to know to start your day.
83,20180823,"Our investigative reporter who spent 16 days covering the Paul Manafort trial, Sharon LaFraniere, answers our readers’ questions on Manafort’s conviction and Cohen’s guilty plea."
84,20180823,"After President Trump’s Terrible Tuesday, Republican lawmakers need to stop pretending that there are any red lines that he won’t cross."
85,20180822,The White House needs a rewrite.
86,20180822,Facebook showed it was proactive against online threats when it revealed new global influence campaigns this week. But being proactive is far from finding a solution.
87,20180822,A suburban Detroit police officer has been suspended after using a stun gun on a combative man while he was holding an infant.
88,20180822,"Dozens of people have been protesting outside a local tax collector's office in Florida, demanding that he resign for posting on Facebook what many perceive was an anti-Muslim comment."
89,20180822,The principled case for impeachment is clear. What’s missing is the courage.
90,20180822,"The Kremlin on Wednesday rejected allegations from Facebook that Russia's GRU military intelligence service had been using the social media site to run disinformation campaigns, saying it did not understand the basis for such accusations."
91,20180822,Authorities have released video showing the crash of a police helicopter in Arkansas that left one person injured.
92,20180822,"Facebook Inc, Twitter Inc and Alphabet Inc collectively removed hundreds of accounts tied to an alleged Iranian propaganda operation on Tuesday, while Facebook took down a second campaign it said was linked to Russia."
93,20180822,Revelations from the Michael Cohen and Paul Manafort court cases could make it harder for the president to continue his sweeping deregulation.
94,20180822,Wednesday: Mental health at jobs and a new hub for freelancers.
95,20180822,"One group is using it to bring Israeli and Palestinian youth together. So far, it’s working."
96,20180822,"Who knows, the once-cocky fixer, now humbled, could find himself a star witness at hearings on impeachment of our 45th president. "
97,20180822,"Your daily look at late-breaking news, upcoming events and the stories that will be talked about today:"
98,20180822,Here’s what you need to know to start your day.
99,20180822,Our humanity is a process that begins with negation. 
100,20180821,The case highlighted the little-reported subject of underage sex trafficking in the Dominican Republic.
101,20180821,The man who tried to assassinate President Ronald Reagan will soon undergo a new round of psychological tests before a court decides if he can live under fewer restrictions in a gated community in Virginia.
102,20180821,Sharon Moore had heard the stories about her father getting his duffel bag stolen on his way back from the Korean War. The New Hampshire woman never expected to see any of the contents.
103,20180821,"The S&amp;P 500 stock index rose as much as 0.57 percent on Tuesday to 2,873.23, putting it just above its previous record high of 2,872.87 on Jan. 26. Bolstered by quarterly earnings reports and a rise in stock buybacks, the benchmark S&amp;P 500..."
104,20180821,"Red salmon, a summertime pleasure that feeds residents through the winter, has failed to show up this season in most rivers."
105,20180821,"We know that trolls on social media are trying to sow discord on contentious subjects like race, guns and abortion, but how do they do it? Here is a visual guide to their strategy."
106,20180821,"There’s scant middle ground in the great New Jersey bear hunt debate, the governor has learned."
107,20180821,Chicago police say disciplinary action is being taken against two officers after photographs of them sleeping inside a police vehicle spread on social media.
108,20180821,"No one is sure whether spirits can convey “terroir” like wine does. But distillers are seeking, and selling, that sense of place."
109,20180821,Maybe she just had a few babies to deliver.
110,20180821,"Towns where people use Facebook more also had more attacks on refugees, building on suspicions that the platform makes users more prone to violence."
111,20180821,I try to remember that every living thing arose from essentially the same genetic foundation. 
112,20180821,The magazine’s Ethicist column on accidentally finding out online that your child has kids and handling a relative with an addiction.
113,20180821,"India said Facebook-owned WhatsApp had pledged on Tuesday to develop tools that would combat fake messages, to help the country crack down on people whipping up public anger through  mass message forwards on social media."
114,20180821,"Indonesian officials have defended a street parade that involved veiled kindergarteners carrying replica weapons, with police saying they will arrest the person who uploaded a video of the event to Facebook."
115,20180821,"Honeybees are under siege, straining the business of farming. Now growers are turning to other bee species to help their crops. "
116,20180821,"Hala Shiha quit the glamorous film industry a decade ago to embrace a more religious lifestyle, adopting the traditional Muslim headscarf, or hijab, along with loose, long-sleeved clothes. The Egyptian movie star later was seen wearing the even mo..."
117,20180821,Microsoft has uncovered new Russian hacking efforts targeting U.S. political groups ahead of the midterm elections.
118,20180821,"Microsoft was surprised not that recent “spear phishing” attempts had occurred, but that they targeted traditional conservative think tanks. Those groups have been critical of Russia."
119,20180821,"It was a beautiful morning, according to New Zealand's minister for women, so after 42 weeks of pregnancy she decided to hop on her electric bicycle and ride to the hospital to give birth to her first child."
120,20180820,Monday: Route 495 repairs and a summer of magic.
121,20180820,He believed in the vision of the United Nations but understood that it might never achieve it.
122,20180820,The imprisonment of Bangladesh’s most respected photojournalist illustrates the country’s drift toward autocracy.
123,20180820,"The divergent geography of 2018 means we will really have two midterm elections, and one favors Republicans."
124,20180820,"Summer is ending, and all my baby birds are leaving the nest. "
125,20180820,We don’t see the problem with our self-importance because our narcissism is so complete. 
126,20180820,"Transgender and gender variant issues have more recently become part of the public consciousness, but many narratives leave out those who are older."
127,20180820,"U.S. businesses have a message for the Trump administration: New tariffs on $200 billion (&#163;156.42 billion) of Chinese imports will force Americans to pay more for items they use throughout their daily lives, from cradles to first bicycles and..."
128,20180819,"Rejecting the strictly Orthodox monopoly over marriage and divorce, Israeli Jews increasingly opt for alternative weddings."
129,20180819,"The more Trump is cornered, the more he mirrors Richard Nixon."
130,20180818,"It is in the striving, and also in what we are striving for."
131,20180818,"For the first time in modern history, Republicans are refusing to request a Supreme Court nominee’s relevant papers. "
132,20180818,"Watch out, the secretary of education is on the loose."
133,20180817,The department suggested Facebook could be held liable if housing providers used the site’s targeting tools to discriminate against prospective renters and buyers in advertising their properties.
134,20180817,"“I never expected — or wanted — to have to be a whistleblower,” Cara Mund, the winner of Miss America 2018, wrote in a letter."
135,20180817,A group of top former intelligence and military leaders are sending a message to the nation’s troops and spies: think twice before following the president’s orders in a crisis. 
136,20180817,"Paired with raspberries in this summery dessert, the smooth-skinned fruit bubbles beneath sweet biscuits studded with candied ginger and pistachios."
137,20180817,"A motion filed on behalf of a Sandy Hook victim’s father accused Mr. Jones, who is being sued for spreading false claims about the 2012 school shooting, of deleting videos and social media posts."
138,20180817,Remembering Ms. Franklin’s last-minute substitution for Luciano Pavarotti at the Grammy Awards was a highlight of the week.
139,20180817,"When you see someone who looks like you, it reveals what is possible. "
140,20180816,I’ll cut straight to the chase: I want in.
141,20180816,"With the departure of a compromised top prosecutor, the country’s new president can now take on endemic corruption in government and the ruling African National Congress. "
142,20180816,"Lugging her cumbersome camera around mid-20th century New York, Evelyn Hofer captured a rapidly changing city, slowly, sensitively and methodically."
143,20180816,The cheese was found in a tomb that had been thought lost to shifting sands until it was rediscovered in 2010.
144,20180816,Facebook gives political campaigns the ability to tailor ads to as few as 20 people. Critics say the technique can polarize and manipulate voters.
145,20180816,"“People think that if you overdose on drugs, you either die or you’re O.K., but that’s not true.”"
146,20180816,How the Queen of Soul preached to us all.
147,20180816,"Chris Watts was arrested Wednesday in Frederick, Colo., on suspicion of killing his pregnant wife and two young daughters."
148,20180816,"To dig a nest tunnel quickly and get the most out of their efforts, 30 percent of fire ants do 70 percent of the work."
149,20180816,Scientists at Lawrence Livermore National Laboratory said they were “converging on the truth” in an experiment to understand hydrogen in its liquid metallic state.
150,20180815,He was serving a life sentence for his role in importing heroin and was accused of plotting to murder the mastermind of the theft of drugs from the police.
151,20180815,"In order to post a picture to Facebook or send an email, Cubans must buy an access card and find a public hot spot. But a recent test hinted that this may soon change."
152,20180815,"Shelly Fitzgerald, who works at a Catholic School in Indianapolis, was put on paid leave after school leaders got a copy of her marriage certificate."
153,20180815,"Readers wrote about harnessing the power of their identities when offering an opinion, but without relying on it to do the work for them."
154,20180815,"By making monasteries, of a sort, of our homes and hearts, we may develop the spiritual disciplines necessary to endure this seemingly endless trial. "
155,20180815,"After becoming the target of a hateful online campaign, Maddie, a seventh grader in a small Oklahoma town, said, “I’m going to keep my head held up high.”"
156,20180815,"Bureaucratic reshuffling made it difficult for the company, an emblem of Chinese innovation, to get approvals to make money off new games, hurting earnings."
157,20180815,"For this issue, a look at the unlikely activists who took on Google and Facebook as they made billions mining personal data."
158,20180815,Some of the biggest recycling operations are owned by landfill companies whose profits improve when recycling doesn’t work well.
159,20180815,The Metropolitan Police said a 29-year-old man from Birmingham had been arrested on suspicion of attempted murder. Local news reports named him as Salih Khater.
160,20180814,A president doesn’t have the right to dispense with laws he dislikes.
161,20180814,But justice will prevail.
162,20180814,"We are a long way from the Stoicism of Seneca, but grief and how we deal with it is still a vital part of the human experience. "
163,20180814,"Tuesday: A peaceful part of the city, and a bath for a titanosaur."
164,20180814,Officials had criticized the Foreign Correspondents’ Club of Hong Kong for hosting a talk by the founder of a party the government wants to ban.
165,20180814,"The only vaccine was taken off the market more than 15 years ago. As reports of the disease skyrocket, researchers are working on a new one."
166,20180814,"Mining personal data has become a trillion-dollar business — which is why activists are pushing laws to curb the practice, and why Facebook and other companies are desperate to stop them."
167,20180814,"Donna Gottschalk’s photographs reveal the radical lesbian, sometimes separatist, communities she was a part of in the late ’60s and ’70s."
168,20180813,Executives are permitted to disclose market-moving information on social media. But Mr. Musk has provided regulators ample opportunity to re-examine the policy.
