,Date,Snippet
169,20180813,"Orthodoxy should be respected, but we cannot allow the politics of a radical minority to alienate millions of Jews worldwide. "
170,20180812,"In 1985, Billy Ray Irick committed a hideous crime in Tennessee. Last week, the state of Tennessee responded in kind."
171,20180812,"Madison Jane Lyden, 23, was killed while bicycling in New York during “the trip of a lifetime.” A garbage truck driver has been charged in her death."
172,20180812,"The investment of venture capital money into ad tech start-ups is falling sharply, helping push a wave of acquisitions."
173,20180812,"The president inflicts pain, all right."
174,20180812,Here’s what you need to know about the week’s top stories.
175,20180812,"Many of the sites are gone or have been transformed, but one woman offers tours to help preserve a legacy at risk of being forgotten."
176,20180811,"Want to understand how workers so often get a raw deal, even during a growing economy? Ask long-haul truckers."
177,20180811,"No parent wants to put his or her child’s life at risk. But for families like mine, crossing the border was our only hope for a better future. "
178,20180811,Trump’s winning coalition and its weaknesses.
179,20180811,Searching for a shared humanness in North Korea.
180,20180810,Ramadan Dabash doesn’t care if you call him a collaborator. 
181,20180810,"Two years earlier, she rejected the ambitious, Manhattan version of herself. After an ugly breakup, it was time to get her back."
182,20180810,"Twenty months after the president-elect reached a deal to keep blue-collar jobs from leaving the country, absenteeism plagues the Indiana plant."
183,20180810,"As exasperating as the debate about tech giants’ role in policing content may be for Americans, people in China can only dream of having such discussions."
184,20180810,The clash over the proposal exposes the tensions within the E.P.A. over the Trump administration’s efforts to roll back environmental regulations.
185,20180810,"It’s the only way to achieve universal, affordable and high-quality health insurance."
186,20180810,"To participate, just post a comment here by Aug. 17 at 7 a.m. Eastern. This week’s winners will be announced on Aug. 28."
187,20180810,Not every opinion needs to be underwritten by your race or gender or other social identity.
188,20180810,"Yes, a majority of Americans find Trump repulsive. But more important, his policies are not popular. "
189,20180810,"Echoes of the majoritarian rhetoric preceding the ethnic cleansing of the Rohingya can be heard in India as four million, mostly Bengali-origin Muslims, have been effectively turned stateless. "
190,20180808,"Days after Google, Facebook and Apple removed Infowars content, the app from the right-wing conspiracy site has surged in downloads."
191,20180808,"The president, either willfully ignorant or playing to his base, tweets nonsense about the California wildfires and refuses to acknowledge the role of climate change in the disaster."
192,20180808,A foster parent of a child found last week at a New Mexico compound told the authorities that adults there had trained the child to use an assault rifle to carry out school shootings.
193,20180808,"Inwood will be the fifth neighborhood to be rezoned under Mayor Bill de Blasio, who has pledged to use zoning laws to increase affordable housing."
194,20180808,Some researchers think mechanical brushes aren’t just some spa amenity for dairy cows — they’re important to the animal’s well-being. 
195,20180808,"In this week's newsletter, we've got a bit about everyone's favorite summer pest, and about Trump’s plan to freeze standards on automobile pollution."
196,20180808,"Shahidul Alam, Bangladesh’s best-known photojournalist, was arrested after posting Facebook video in which he appeared to criticize the government’s handling of recent student-led protests."
197,20180808,Here’s what you need to know to start your day.
198,20180808,"When it comes to online comments and discourse and what you can do to limit their toxicity, you only have a certain amount of power. The real leverage lies with the tech companies. "
199,20180808,The episode prompted calls by Cincinnati officials to change a rule that allows police officers to use stun guns on children as young as 7.
200,20180807,Television dramas and comedies thrive on complexity. But journalism’s reductive picture of society makes America more polarized and feeds the extremes.
201,20180807,"The maker of Snapchat said it lost 3 million daily active users in the latest quarter, following similar drops or flattening growth from Facebook and Twitter."
202,20180807,"The Facebook-owned messaging service says it is still safe, and what Check Point Software discovered was a system operating as it was intended."
203,20180807,"Human visitors scared away least terns, which are considered a threatened species in the state, and used their eggs to decorate the sand."
204,20180807,"The rules that Apple, Google, Facebook and Twitter follow in their roles as arbiters of online speech are often vague. Critics say they are arbitrary."
205,20180807,Here’s what you need to know at the end of the day.
206,20180807,Donald Trump’s “look over there” media strategy is a trap that keeps Democrats from focusing public attention on his bad policies.
207,20180807,"For a generation of people with cochlear implants, technology is transforming the experience of deafness."
208,20180807,"Flynn McGarry, who has been charging money for meals since he was 13, gets his first real restaurant at age 19."
209,20180807,"Tesla’s chief executive suggested that being a public company, beholden to shareholders, created perverse incentives for short-sellers."
210,20180806,America needs a new model of campaign finance not to supplant the political marketplace but to correct for its inadequacies. 
211,20180806,Police officers and paramedics went into overdrive to respond to a torrent of street violence. Officials blamed judges and parents.
212,20180806,"The time has come to end cash bail, a major factor in inequality in the court system."
213,20180806,Monday: “Shaping” surfboards in the city and Andy Warhol’s birthday.
214,20180806,Domestic migrant workers in the Middle East continue to face confinement and abuse.
215,20180806,Some people changed which party’s nominee they voted for from 2012 to 2016. They are key to who wins the House and Senate.
216,20180806,"After the government sought to ban the pro-independence Hong Kong National Party, officials have tried to keep its leader from giving public talks"
217,20180806,"Robyn Price Pierre looked to her family, classmates and friends to create personal photos exploring black fatherhood."
218,20180806,"Australia’s race commissioner exited office with an indictment of race-baiting commentators and politicians. Here are excerpts from his speech, annotated. "
219,20180806,I’ve become invisible. I like it.
220,20180804,"Democrats are shifting left on immigration, and it shows at the polls. "
221,20180804,"Targeted by the Taliban in northern Afghanistan, the Islamic State militants turned themselves into the government, but many civilians are furious at what they see as lenient treatment."
222,20180804,A queer online dating community has formed around an old-school format for hookups.
223,20180804,"The suspect had four run-ins with officers at three national parks in a week, the authorities said. Now, he’s in jail."
224,20180804,"From Paul Manafort’s trial to multiple presidential rallies, it’s been a busy week. Here’s what you might’ve missed (and some links if you want to read further)."
225,20180804,The nation state is trumpeted. The nation state is redundant. 
226,20180804,Summer fun: Do you really want Paul Manafort on the grill?
227,20180803,One Irish woman’s unscientific investigation.
228,20180803,Pope Francis declares capital punishment unambiguously wrong. No exceptions. 
229,20180803,All of the weddings right here on one handy page for you.
230,20180803,The remarkably successful Ohio State football coach is learning that tolerance for off-the-field problems is at an all-time low.
231,20180802,"Apple is part of a group of giant companies that dominate the United States economy. That is good for financial markets, but not necessarily for everyone else."
232,20180802,Newly discovered early glimmers of legal brilliance from “America’s lawyer.”
233,20180802,"President Trump and Giuseppe Conte, the new Italian prime minister, play to their publics by demonizing immigrants. "
234,20180802,Here’s what you need to know at the end of the day.
235,20180802,"His photographs of mid-20th-century New Yorkers capture a moment in the city, but more than that, they preserve the people who lived those moments."
236,20180802,The Smith College student was sitting in a common area when a staff member reported her. The college’s president has apologized and the staff member was placed on leave.
237,20180802,"The legislation is one of the biggest efforts to date by Congress to wrestle back some authority to shape foreign policy, but whether it could actually become law is another question."
238,20180802,"Nearly four decades after the Sandinistas overthrew the Somoza dynasty, Nicaragua is once again in the grip of tyranny. "
239,20180802,"By its astoundingly cynical approach to deficits and debt, the G.O.P. has opened the door to an expansive left. "
240,20180801,"Kelvin Droegemeier, a well-regarded meteorologist, has a long research record. But his views on climate change are not well known. "
241,20180801,"His satires were not well received by the Soviet authorities, and in 1980 he thought it best to live in the West until things thawed out."
242,20180801,A report by an independent journalist included text message exchanges suggesting Meyer knew of Zach Smith’s abusive relationship with his wife. Meyer said last month he did not.
243,20180801,"How a 57-year-old civil servant who likes to cook, read and write found herself boxing in the outback. "
244,20180801,"State Representative Nick Sauer, a Republican, said he would leave office hours after a report that he used an Instagram account with the photos to “catfish” men online."
245,20180801,Here’s what you need to know at the end of the day.
246,20180801,"The woman, a 22-year-old engineering student, has created a website and Facebook page for other women to share stories of sexual harassment."
247,20180801,State officials announced lawsuits targeting a half-dozen sites around the state where communities are still feeling the effects of pollution.
248,20180801,"Lesley Nneka Arimah’s debut short story collection is our August pick for the PBS NewsHour-New York Times book club, “Now Read This.”"
249,20180801,"Alex Stamos, Facebook’s chief security officer, is joining Stanford to teach and to examine the role of security and technology in society."
250,20180801,Recent incidents around the country have raised questions about diversity training in the hotel industry.
251,20180801,"Facebook’s earnings report sent tech stocks cratering. But don’t let that fool you: Apple, Google, Facebook, Amazon and Microsoft are still on their way to dominating the future."
252,20180801,"Poking fun at President Trump for how often he repeats “No collusion,” Stephen Colbert said, “He uses it for every occasion — it’s like his ‘aloha.’”"
253,20180801,"Melissa Ann Pinney’s project exploring female identity spans three decades and presents women and girls as subjects in their own right, not as accessories in the lives of men."
254,20180801,Cody Wilson is engaged in a legal fight to distribute blueprints for printing 3-D weapons. He calls his efforts “a pretty mainline American idea.”
255,20180801,Here’s what you need to know to start your day.
256,20180801,"The chain, Aloha Poke Co., which sent cease-and-desist letters to restaurants with similar names, has apologized after being accused of cultural appropriation."
257,20180801,Chicago commemorates a crusading hero who never got the recognition she deserved.
258,20180731,Its new president can help his country and the world by tackling climate change through sustainable development.
259,20180731,The Treasury secretary floats a plan to hand $100 billion in capital gains tax savings to his moneyed friends. It’s almost certainly illegal. 
260,20180730,"Toxic algal blooms are not unusual off the state’s coast, but the current episode is the longest in more than a decade. "
261,20180730,"Some state Republicans were for building a border wall before Donald Trump gave it a thought. But in many rural areas, immigrants are keeping the place alive."
262,20180730,"To understand why white supremacists back the president, we have to understand the books that define their worldview."
263,20180730,I am fluent in Israel’s language and culture. I respect its laws. And the new Nationality Law rejects me.
264,20180730,The people who stand to benefit most from self-driving cars need to be heard.
265,20180730,Rising carbon dioxide levels are making the world greener. But that’s nothing to celebrate. 
266,20180730,Bret Stephens imagined Trump’s re-election. I imagine the opposite.
267,20180730,"Monday: A common phenomenon in New York, and staples for a city picnic."
268,20180730,"This year’s monsoon season has brought crippling floods to Southeast Asia, in some cases worsened by a lack of emergency preparations by governments."
269,20180730,The key difference is among regional cultures tracing back to the nation’s colonization. 
270,20180728,Don’t argue with 4.1 percent growth.
271,20180728,The president’s plans for a new military force could spur an extraterrestrial arms race and make combat in orbit more likely. 
272,20180727,"Imran Khan, cricket-star-turned-politician, promises a new path for Pakistan. But his ties to the military, and his own at-times erratic behavior, may stand in the way."
273,20180727,"Growing up in a friendly Dallas suburb, I never imagined the hostility lurking beneath the surface."
274,20180727,"I shut down the sprinkler system and tested a new aesthetic. To my delight, I discovered that it’s beautiful. "
275,20180727,The performance of social media companies depends on avoiding scandals and protecting users. Will investors come to see that?
276,20180727,"In Europe, plants created with gene-editing technologies will be stringently regulated as G.M.O.’s. But older crops whose DNA has been altered will be left alone."
277,20180727,Scores of people dying needlessly on the outskirts of Athens looks more like carelessness than fate. 
278,20180727,"A Facebook suspension and a YouTube probation, for videos that violated policies, followed weeks of controversy over Mr. Jones, who oversees Infowars."
279,20180727,Is urban honey tainted by pollution? 
280,20180726,A Baltimore-based community program provides the architecture for kids’ success.
281,20180726,Here’s what you need to know at the end of the day.
282,20180726,Syrian families have suddenly learned that missing relatives have been registered as dead by the government. Rights groups call it an admission that they were killed in prison.
283,20180726,The plunge in Facebook’s stock is a stark reminder of the dangers of giving high-flying companies the benefit of the doubt.
284,20180726,An accusation that Twitter was suppressing conservative political views drew the attention of President Trump. Here’s what’s really going on.
285,20180726,Plenty could go wrong en route to the most important midterm in a generation. 
286,20180726,Here’s what you need to know to start your day.
287,20180726,Mr. Howard often acted as spokesman for the party during incendiary events. But he was also adept at organizing community programs.
288,20180726,How a reality show became a vehicle for all of the country’s neuroses around sex and gender.
289,20180726,Whether an ant becomes a worker or colony royalty may depend on insulin metabolism.
290,20180725,"Smartphone video, now used to document abuses across the globe, has been crucial in telling the outside world about Syria’s war, says Anne Barnard, Beirut bureau chief for The Times."
291,20180725,For a moment it seemed like the world’s biggest social network had established a beachhead in the world’s largest internet market. But only for a moment.
292,20180725,Also: Georgia Republicans pick a hard-right nominee for governor. 
293,20180725,Offering farmers handouts to ease the sting of tariffs could easily end up with calls for bailouts across much of the American economy.
294,20180725,"James Baldwin understood the difference between empathy and approval. Today, we would rather condemn than understand."
295,20180725,Wednesday: Riding our city’s new bikes and the slowest buses in the city.
296,20180725,"Trump’s G.O.P. is not the party of Reagan and Bush, but of a much older, darker American political tradition."
297,20180725,New Zealand's government has said that Australia “copied” its national flag. They're not the only countries with similar flag designs. Can you identify the right nation's flag?
298,20180725,"The Catholic Church needs an inquest into what the pederast cardinal's colleagues knew, and when."
299,20180725,Strategies for traveling without letting your phone keep you from enjoying your trip.
300,20180724,"Clérigos en Nicaragua, Fuerzas Armadas argentinas y negocios con Melania Trump: lo que está sucediendo en América Latina y en el mundo."
301,20180724,"Signature Bank is being investigated by New York regulators, with a focus on loans that may have violated laws intended to prevent predatory behavior."
302,20180724,"Our columnist gets a taste of two beautiful, complicated Baltic cities — each a capital celebrating the 100th anniversary of its country’s independence."
303,20180724,New York City cannot afford to lose one of its fiercest champions.
304,20180724,"Tuesday: Making subways and buses more accessible, and moving a time capsule."
305,20180724,Here’s what you need to know to start your day.
306,20180724,"Mr. Colbert said, “It seems like an all-caps note is not necessarily the way to deal with a hostile foreign leader.”"
307,20180724,"For two decades, students of the International Center of Photography at the Point have learned analog photography and documented their community. "
308,20180724,"Less than a week after the European Union fined Google $5.1 billion for abusing its dominance in smartphones, the tech giant still posted big profits."
309,20180724,"If you want to beat Trump, centrism is not the answer."
310,20180722,President Trump’s choice for the latest Supreme Court vacancy will continue a trend toward widening America’s power and wealth gaps.
311,20180722,Trump makes denuclearization work — for North Korea.
312,20180722,"A second-quarter G.D.P. estimate is issued, and there will be a hearing on tariffs on Chinese goods."
313,20180722,"A measure in Parliament would fine social networks about $800,000 for posts deemed factually inaccurate. Critics say it could limit freedom of speech online."
314,20180722,All of the weddings right here on one handy page for you.
315,20180721,In cities across Australia demonstrators denounced five years of a policy that has left thousands detained on remote Pacific islands.
316,20180721,"The request, by Russia’s foreign minister, followed a week when Moscow had appeared to control the narrative on a range of international issues."
317,20180721,"One version of the events, anyway."
318,20180721,"As a gay man, I wasn’t eager to return to the faith community that had pushed me away. But maybe there was a way in."
319,20180721,"A Michigan ballot initiative points the way to reforming gerrymandering, one of the most anti-democratic practices in American politics. "
320,20180720,"Mark Zuckerberg, the company’s chief executive, prompted outrage after his attempt to explain its stance on hate speech and misinformation — and the difference between the two."
321,20180720,"If the N.R.A. was compromised by Russia, the whole party's in trouble. "
322,20180720,Here’s what you need to know to start your day.
323,20180720,"No longer anonymously run, Sleeping Giants continues its mission of alerting companies to where their digital ads end up."
324,20180720,"As coral ecosystems face worldwide decline, Alexis Rosenfeld and Alexie Valois were set on chronicling their majesty and their plight — as well as efforts to restore them."
325,20180720,Here’s what you need to know to start your day.
326,20180720,"A life cut short is revealed through reward cards, drink coupons and arcade passes."
327,20180720,"Corrections appearing in print on Friday, July 20, 2018."
328,20180720,The government has shut down a dependable database on health science.
329,20180720,"Asked about the kind of content Facebook keeps up and the kind it removes, company executives from Mark Zuckerberg on down have been comically tripped up in their responses."
330,20180718,"Critics say the company has not done enough to block false posts that have led to attacks in countries including Sri Lanka, Myanmar and India."
331,20180718,European officials have fined Google a record $5.1 billion. History suggests the company’s share price won’t be affected.
332,20180718,
333,20180718,Facebook’s chief executive had said in an interview that false and “deeply offensive” conspiracy theories alone were not enough to get someone barred from the site.
334,20180718,He spent a fortune on tickets for a woebegone baseball team.
335,20180718,Here’s what you need to know to start your day.
336,20180718,Our newly engaged tech columnist tried to use tech to plan his wedding. He was immediately overwhelmed by the complexity of the process.
337,20180718,A mother notes that her two sons are often wrongly identified as the other by facial recognition technology.
338,20180718,A selection of novels featuring men on their worst behavior.
339,20180718,A baby snake and snakeskin were preserved in two specimens found in Myanmar.
340,20180718,A new study based on Facebook data provides a picture of who is placing political ads on the social network ahead of the midterm elections. President Trump tops the list.
341,20180718,Some Republicans say President Trump embarrassed himself and the country in his meeting with Vladimir Putin. Here’s what they can do about it.
342,20180717,"Faith in the justice system and in our intelligence agencies cannot be collateral damage in a partisan grudge match, says the former director of the F.B.I. and C.I.A."
343,20180717,It’s become a huge source of power for Trump and trouble for the rest of us.
344,20180717,The United States has accused Ms. Butina of working with Americans to carry out a secret Russian effort to influence U.S. politics. But she is hardly a shadowy figure. Here’s a look at what her online profile reveals.
345,20180717,"A new medical scanner, derived from technology used by particle physics researchers at CERN, “is like the upgrade from black-and-white film to color,” one of its developers said."
346,20180717,A jury convicted Marq Vincent Perez on all counts in the arson at a mosque and Islamic community center in January 2017.
347,20180717,"How the skins of oranges, lemons and other fruits squirt oil in tiny bursts."
348,20180717,A 96-year-old who fled the Holocaust finds a new way to be heard.
349,20180717,"As much as I love this tournament, I know that it can’t last forever. "
350,20180716,"Many famous studies of human behavior cannot be reproduced. Even so, they revealed aspects of our inner lives that feel true."
351,20180716,President Trump has singled out Europe as a trade foe. Some people worry that President Vladimir Putin of Russia might exploit that tension.
352,20180716,Some would say the mistake was having our daughter in the first place. 
353,20180716,"Monday: A call for submissions for odd objects seen in the city, and the newly appointed Nightlife Advisory Board."
354,20180716,The judge insists that federal agencies stay within the limits of law and delegated authority. 
355,20180716,Experts did little better than dog lovers — and nobody did very well — when asked to describe the heritage of various mutts. 
356,20180716,"Around the globe, flashy military performances have a more serious purpose: getting people with high-tech skills to sign up."
357,20180716,A bill in the California legislature would regulate bots by making them disclose their automated nature. But how?
358,20180716,"When his career began in the 1950s, Latif Al Ani captured scenes of Iraqi life in a more innocent time. "
359,20180716,Just look around Europe: It’s clear that accommodating radical nationalists is a losing proposition. 
360,20180713,"A special election for a House seat in Ohio will test the power of the rural vote against the kind of affluent, rapidly growing suburbs that Democrats need to win."
361,20180713,"Amid a growing call for governments to rein in the use of the technology, Microsoft became the first tech giant to join the chorus."
362,20180713,Pro-American Germans feel betrayed.
363,20180713,"Make time for surf-and-turf burgers, nachos or even homemade taramasalata."
364,20180713,The president has said that Britain’s plan for a soft Brexit mean he’s unlikely to negotiate a new trade deal with the nation.
365,20180713,Friday: Public outdoor pool season and invasive species awareness week.
366,20180713,They grew up on Oahu and went to rival schools but didn’t meet until after they moved to New York.
