,Date,Description
503,2018-08-08,"The Trump administration completed plans to impose new tariffs on $16 billion in Chinese imports, bringing the total value of products covered by the duties to $50 billion by the end of the month."
504,2018-08-07,A number of bankers and private-equity investors privately cast doubt on Elon Musk’s ability to pull off a buyout of Tesla Inc. after he raised the possibility in a series of tweets Tuesday.
505,2018-08-07,The state spends 10 times more on electric car subsidies than on dead tree clearing.
506,2018-08-07,"Bigotry is bigotry, whether systemic, as at Harvard, or idiosyncratic, like Sarah Jeong’s Twitter feed."
507,2018-08-07,"Wall Street Journal When Russia Invaded Georgia Wall Street Journal Like many other heads of state, I had planned to attend the 2008 Summer Olympics in Beijing. I canceled my trip after Russian-backed separatists began firing on Georgian positions in the brea…"
508,2018-08-07,A study shows that it was a tussle between new and old media that shaped the race.
509,2018-08-07,"‘Any jackass can kick down a barn, but it takes a carpenter to build one.’"
510,2018-08-07,Turkey has dispatched top officials to Washington to defuse a series of bilateral spats with the U.S. that have exacerbated tension between the two NATO allies and pushed the Turkish currency to record lows.
511,2018-08-07,A plan from Trump-appointed officials at SEC is running into criticism from both brokers and investors.
512,2018-08-07,"Wall Street Journal Richard Gates Says He Set Up Offshore Companies to Hide Manafort's Money Wall Street Journal ALEXANDRIA, Va.— Paul Manafort's longtime associate Richard Gates on Tuesday provided a detailed portrait of actions he said he undertook at Mr. M…"
513,2018-08-07,"Large companies have mostly shrugged off the impact of the administration’s trade skirmish with China. Smaller ones and startups lack the wiggle room to absorb cost increases or shift production, and many are reevaluating their plans and strategies."
514,2018-08-07,"Federal prosecutors in New York are examining whether Cohen committed tax fraud, people familiar with the investigation said."
515,2018-08-07,"Wall Street Journal Oil Rises as Trump Issues 'Biting' Sanctions on Iran Wall Street Journal Oil prices rose Tuesday after President Trump said on Twitter his government will strictly enforce renewed sanctions on Iran, including those aimed at choking off Ira…"
516,2018-08-07,"WSJ City is the app that delivers concise, smart news on business and finance for mobile. Download for iPhone or Android. Here’s essential reading on today’s developments. MUST READS FROM WSJ CITY South Korea is threatening to block a revised free-trade agree…"
517,2018-08-07,"Billionaire activist investor Carl Icahn sent an open letter urging Cigna shareholders to vote against the company’s $54 billion plan to buy Express Scripts, calling it a “folly” carrying a “ridiculous” price tag."
518,2018-08-07,"Tens of thousands of Central Americans are making the dangerous journey north to the U.S. each year. The cash many send back can change the lives of their families, and the money has become essential to the economies of Central America."
519,2018-08-07,News and analysis from WSJ's Washington bureau
520,2018-08-07,The biggest bank in the island nation of Cyprus has turned from a lender once reputed for its secrecy into something of a cooperating witness in the Paul Manafort trial.
521,2018-08-07,"South Korea is threatening to block a revised free-trade agreement with the U.S. unless its cars win an exemption from proposed American tariffs, putting at risk the only free-trade deal the Trump administration has successfully renegotiated."
522,2018-08-07,"Ohio’s special election Tuesday is the highlight of a night that includes primary contests in four other states—Kansas, Michigan, Missouri and Washington state. Here are the big themes to watch after polls close tonight."
523,2018-08-07,"Five reasons to consider when retiring to a small town, traders talk up cryptocurrencies only to dump them, and whether the smartphone can replace your trusty wallet."
524,2018-08-07,"A daily digest of The Wall Street Journal’s coverage of energy companies, commodity markets and the forces that shape them. Send us tips, suggestions and complaints: EnergyJournal@wsj.com Newsletter By Neanda Salvaterra SAUDI RIFT WITH CANADA RISKS BACKLASH F…"
525,2018-08-07,"This is the web version of the WSJ’s newsletter on the economy. You can sign up for daily delivery here. Good morning! Today we look at what’s moving inflation, bid to let more aluminum into the U.S., supply and demand in food and energy markets, the latest o…"
526,2018-08-07,The Trump administration said it would soon restore sanctions against Iran. The WSJ's Gerald F. Seib looks at a possible reason behind the policy change. Photo: Getty
527,2018-08-07,Firefighting crews continued to battle what officials described as the second-largest wildfire in California history.
528,2018-08-07,"Paul Manafort’s longtime associate, Richard Gates, says he committed tax and bank fraud with Mr. Manafort in the criminal trial of the former Trump campaign chairman."
529,2018-08-07,He admits his mind is made up on Kavanaugh. That means his document demands are in bad faith.
530,2018-08-06,Carl Icahn is going public with his campaign to scuttle Cigna Corp.’s $54 billion plan to buy Express Scripts Holding Co.
531,2018-08-06,Want a steel exemption? Meet your new Commerce overlords.
532,2018-08-06,"In the name of free speech, journalists suppress a slogan."
533,2018-08-06,Latin America’s crisis turns Washington’s Cold War nightmare on its head.
534,2018-08-06,Trump’s Americans First policy prioritizes freeing our citizens held hostage abroad.
535,2018-08-06,The largest U.S. aluminum maker wants an exemption from tariffs designed to bolster domestic metal production.
536,2018-08-06,"Donald and the Di-Spy Donald Trump couldn’t resist commenting on the news that Democratic Senator Dianne Feinstein was the target of Chinese spying, but he missed the main point. “I like Dianne Feinstein, I have to tell you, but I don’t like the fact she had …"
537,2018-08-06,Is this more than a story about Trump trolling?
538,2018-08-06,"President Trump endorsed Kris Kobach in the Kansas gubernatorial race, boosting the Republican as he challenges the state’s incumbent GOP governor in Tuesday’s primary."
539,2018-08-06,"The funds for the Patriot Legal Expense Fund Trust came mostly from a trio of longtime Trump allies, according to a new tax filing reviewed by The Wall Street Journal."
540,2018-08-06,"Sen. Rand Paul (R., Ky.) met with Russian lawmakers and invited them to Washington as part of a growing outreach to the Kremlin following President Trump’s summit with Russian leader Vladimir Putin last month."
541,2018-08-06,"WSJ City is the app that delivers concise, smart news on business and finance for mobile. Download for iPhone or Android. Here’s essential reading on today’s developments. MUST READS FROM WSJ CITY Facebook wants your financial data. The social media giant has…"
542,2018-08-06,"The most important people around President Trump these days are four top advisers who come from quite different backgrounds, but have one thing in common: They are contemporaries of the 72-year-old president."
543,2018-08-06,The measures are the first economic action President Trump has taken against Iran since announcing in May that the U.S. was withdrawing from the 2015 Iran nuclear accord.
544,2018-08-06,"Jelena McWilliams, chairman of the FDIC, says in her first interview since her swearing in, that she is ready to re-evaluate rules on bank capital, small-dollar loans and investments in low-income areas."
545,2018-08-06,"LeBron James is arguably the world’s greatest basketball player. He’s also a serious cyclist, and he’s giving every student at his new school a bicycle in part because it changed his own life when he was a kid. “It was a way of life,” LeBron said. “If you had…"
546,2018-08-06,"Thousands of protesters have taken to Iran’s streets in recent days in the biggest wave of unrest since January, calling for financial help and regime change as the U.S. prepares to impose new sanctions on the country."
547,2018-08-06,News and analysis from the WSJ's Washington bureau
548,2018-08-06,"The Trump administration expects Iran’s oil buyers to begin winding down their purchases by Tuesday. But countries including China, India and France are considering creative measures to keep importing Iranian crude."
549,2018-08-06,"A daily digest of The Wall Street Journal’s coverage of energy companies, commodity markets and the forces that shape them. Send us tips, suggestions and complaints: EnergyJournal@wsj.com IRANIANS HOARD GOLD AHEAD OF U.S. SANCTIONS Iranians have been buying g…"
550,2018-08-06,"Wall Street Journal Tech Firms, Embattled Over Privacy, Warm to Federal Regulation Wall Street Journal WASHINGTON—U. S. tech companies, battered over their handling of consumers' personal data, are hoping to get ahead of the public and legal fallout by workin…"
551,2018-08-06,"Today in Real Time Economics, we look at strong profits and rising prices, a Canadian boycott and other fallout from trade tensions, and the booming U.S. labor market."
552,2018-08-06,Wall Street Journal Senators Signal Concerns Over China's Global Investments Wall Street Journal WASHINGTON—Several U.S. senators are pressing the Trump administration to detail what it is doing to deal with Beijing's financing of international infrastructure…
553,2018-08-06,華爾街日報 中國威脅對600億美元美國商品加征關稅 華爾街日報 中國計劃對多數美國進口商品徵收關稅，此舉旨在對特朗普(Trump)政府的關稅威脅進行以牙還牙的報復，勢必導致這兩個全球最大經濟體之間的貿易緊張關係進一步惡化。 上周初美國總統特朗普加大對中國施壓力度，威脅將把對中國進口商品的擬征關稅提高一倍... 社論》貿易戰中國何以屈居下風？ 自由時報電子報 【貿易開戰】中國最新擬對美加徵關稅清單，ＬＮＧ半導體等上榜 經濟通 中國反制牌不如美國多 雅虎香港新聞 udn 聯合新聞網 - 青年日報 (新聞發布) - 多…
554,2018-08-06,The Trump administration’s plan to keep deficits in check doesn’t take into account possible economic slowdown and recession.
555,2018-08-05,"Secretary of State Mike Pompeo faced criticism from China and skepticism from Southeast Asian powers over U.S. trade policies, as well as a warning from North Korea about Washington’s approach to talks, at a weekend meeting of regional leaders."
556,2018-08-05,"As trade tensions mount, countries that really want to needle the U.S. are springing retaliatory tariffs on the cranberry, a quintessentially American export."
557,2018-08-05,Wall Street Journal Harvard's Education in Discrimination Wall Street Journal The Trump Administration in July withdrew Obama-era guidance that gave colleges a wink and a nod to racially discriminate. This means that colleges like Harvard that use racial pref…
558,2018-08-05,The sanctions erode as Pyongyang continues its nuclear arms program.
559,2018-08-05,President Donald Trump acknowledged Sunday that a meeting his son held with a Russian government lawyer in June 2016 was an attempt “to get information on” Democrat Hillary Clinton but defended the encounter as “totally legal.”
560,2018-08-05,Top administration officials are devising new penalties to hit back more forcefully at state-sponsored hackers of critical infrastructure to deter attacks such as the successful penetration of U.S. utilities by Russian agents last year.
561,2018-08-05,The window of opportunity to ratify a revised agreement this year has closed.
562,2018-08-05,It’s one of the most free-market-oriented industries anywhere.
563,2018-08-05,"George Lakoff says Trump is manipulating the voters. To fight back, he proposes to manipulate the voters."
564,2018-08-05,His reorganization plan doesn’t go far enough in reconsidering the ‘headless fourth branch.’
565,2018-08-05,‘Common carriage’ law points to a solution for the problem of censorship on social media.
566,2018-08-05,"Iranians are hoarding gold as a safeguard against a collapsing local currency and soaring cost of living as the U.S. is poised to impose economic sanctions on Iran, pushing the metal’s price to record highs in Tehran."
567,2018-08-05,"Wall Street Journal 'Move It Along': Manafort Judge Sets a Brisk Pace for Prosecutors Wall Street Journal Assistant U.S. Attorney Uzo Asonye was delivering his opening statement in the trial of Paul Manafort, accusing the defendant of using “secret income” to…"
568,2018-08-05,"The Kushner family has closed on a deal to unload its office tower at 666 Fifth Avenue, a building it bought at the top of the market that was ailing financially."
569,2018-08-05,"The Kushner family has closed on a deal to unload its office tower at 666 Fifth Avenue, a building it bought at the top of the market that was ailing financially."
570,2018-08-05,"Wall Street Journal South Sudan Leaders Make Another Attempt at Peace Wall Street Journal South Sudan's leaders signed a peace and power-sharing agreement Sunday, the latest attempt to stop a devastating civil war and humanitarian disaster in the world's youn…"
571,2018-08-05,"When Tennessee Rep. Diane Black placed third in her state’s GOP race for governor last week, she became the fifth House Republican defeated in a statewide primary this year."
572,2018-08-05,The Tuesday special election between Republican Troy Balderson and Democrat Danny O’Connor offers a preview of dozens of midterm races across the country: a reliably Republican district that’s also home to a charged-up Democratic base and a core of suburban v…
573,2018-08-05,"The U.S.-China trade fight has put South Korea’s Samsung Electronics in an uncomfortable spot. Its challenge: to manage its ties to both countries without getting caught in the crossfire, even as U.S. tariffs threaten its sales of home appliances and device c…"
574,2018-08-04,An accountant for Paul Manafort told jurors Friday she believed his tax returns contained inaccurate information and falsely reduced his tax liability by classifying millions of dollars she believed was income as loans.
575,2018-08-04,An accountant for Paul Manafort told jurors Friday she believed his tax returns contained inaccurate information and falsely reduced his tax liability by classifying millions of dollars she believed was income as loans.
576,2018-08-04,"With sky-high approval ratings in his own party, President Trump’s imprimatur at an arena packed with thousands of energetic voters can help build momentum for Republican hopefuls."
577,2018-08-04,Canadians irked by U.S. metals tariffs and President Trump’s harsh words for their prime minister are boycotting American products and buying Canadian goods.
578,2018-08-04,The U.S. State Department said it delivered a letter from President Trump to North Korean leader Kim Jong Un during a regional summit.
579,2018-08-04,The U.S. State Department said it delivered a letter from President Trump to North Korean leader Kim Jong Un during a regional summit.
580,2018-08-04,Secretary of State Mike Pompeo said Washington would raise concerns with Moscow about allegations that Russia has been flouting United Nations sanctions by allowing North Koreans to do business.
581,2018-08-03,"With better incentives, millions on the sidelines could join the workforce."
582,2018-08-03,Easing fuel-mileage rules is a boon to auto makers and consumers.
583,2018-08-03,"Robert Mugabe was deposed, but his methods live on."
584,2018-08-03,The Journal’s weekly guide to the ups and downs of the business world.
585,2018-08-03,A federal judge said the Trump administration is responsible for finding hundreds of immigrant parents deported or released into the U.S. without their children in the wake of the government’s policy of separating families at the Mexican border.
586,2018-08-03,"Top Senate Democrats plan to meet with Brett Kavanaugh, after holding off on sitdowns with the Supreme Court nominee due to a dispute over documents related to his work in the George W. Bush White House."
587,2018-08-03,"When journalists go searching for ‘missed opportunities,’ they should question green tactics."
588,2018-08-03,Bethany Christian Services faces protests and lawsuits for its work with migrants and foster children.
589,2018-08-03,"Betting keeps games honest. When fixing occurs, bookmakers notice and alert the authorities."
590,2018-08-03,An accountant who helped prepare Paul Manafort’s tax returns told jurors Friday he didn’t know Mr. Manafort controlled foreign bank accounts that prosecutors allege were used to disguise millions of dollars in income
591,2018-08-03,"In a larger-than-expected deal, Kushner Cos. has agreed to lease the building to Brookfield Asset Management for 99 years. The record $1.8 billion real-estate investment became controversial when Jared Kushner joined the Trump White House."
592,2018-08-03,U.S. regulators had been looking into whether the oil giant misled investors about risks to business posed by climate change and greenhouse-gas regulations.
593,2018-08-03,U.S. regulators had been looking into whether the oil giant misled investors about risks to business posed by climate change and greenhouse-gas regulations.
594,2018-08-03,"Wall Street Journal US Sanctions Russian Bank for Handling Transactions for North Korea Wall Street Journal WASHINGTON—The U.S. Treasury Department on Friday imposed sanctions on Russia's Agrosoyuz Commercial Bank, saying it handled transactions for North Kor…"
595,2018-08-03,"Beijing fought back again the sliding currency on Friday, suggesting it had depreciated too fast."
596,2018-08-03,"The U.S. trade deficit expanded in June at the fastest rate since November 2016, reflecting rising imports and falling exports."
597,2018-08-03,News and analysis from WSJ's Washington bureau
598,2018-08-03,"Wall Street Journal Pompeo Pitches US Investment to Leery Southeast Asian States Wall Street Journal SINGAPORE—Secretary of State Mike Pompeo on Friday promised a new era of U.S. economic engagement with Southeast Asian countries, extending an olive branch to…"
599,2018-08-03,"Concern over the state of the economy is now eroding support for South Korean President Moon Jae-in, who has spent much of his 15 months in power focused on engaging with North Korea."
600,2018-08-03,"A daily digest of The Wall Street Journal’s coverage of energy companies, commodity markets and the forces that shape them. Send us tips, suggestions and complaints: EnergyJournal@wsj.com TRUMP DONOR AGREED TO PAY MICHAEL COHEN $10 MILLION FOR NUCLEAR PROJECT…"
601,2018-08-03,"Construction executive Bill Lee won the Republican primary for Tennessee governor, the Associated Press projected, in a race featuring four major candidates. He’ll face Democrat Karl Dean, a former four-term mayor of Nashville, the state’s biggest city."
602,2018-08-03,The Trump administration is challenging a tax benefit that gives the wine industry up to $69 million annually and blocking beer and spirits makers from using the same break.
603,2018-08-03,"Canadian Prime Minister Justin Trudeau’s open-arms policy on refugees is facing pushback at home, according to a new poll published Friday."
604,2018-08-03,The Trump administration is calling out Russia and China for easing economic sanctions on North Korea. The WSJ's Gerald F. Seib explains how that action and others could impact nuclear negotiations. Photo: Getty
605,2018-08-03,"Today in Real Time Economics, we look at another month in the longest U.S. hiring streak on record, widening trade deficits and stockpiles of kidney beans, and the Trump administration's latest battlefront: a tax loophole enjoyed by the wine industry."
606,2018-08-03,"County mayor Tim Burchett won the GOP primary for a Tennessee House seat, defeating a candidate who had the backing of outside groups hoping to increase the ranks of GOP women in Washington."
607,2018-08-02,"Trump has a solid record, but he’s too busy making noise to tout it."
608,2018-08-02,"Wall Street Journal Iran Starts Naval Exercise Near Vital Strait, US Says Wall Street Journal WASHINGTON—Iran began a major naval exercise near the Strait of Hormuz Thursday, in an apparent response to rhetoric from President Donald Trump in recent days that …"
609,2018-08-02,Obama’s nominees faced only 17 cloture votes in his first term. Trump’s have faced 108 in 18 months.
610,2018-08-02,Wall Street Journal Top Trump Donor Agreed to Pay Michael Cohen $10 Million for Nuclear Project Push Wall Street Journal A major donor to President Trump agreed to pay $10 million to the president's then-personal attorney if he successfully helped obtain fund…
611,2018-08-02,"Senior U.S. and Mexican officials on Thursday sought to hammer out new rules for the auto trade at the center of negotiations to overhaul the North American Free Trade Agreement, while Canadian officials sat out the latest talks amid persistent tension betwee…"
612,2018-08-02,"A business group made up of the CEOs of 200 of America’s largest companies is urging the Trump administration to stop insisting that Beijing reduce its trade gap with the U.S. and focus instead on pursuing changes to Chinese tariffs, investments and regulatio…"
613,2018-08-02,"The Trump administration has reduced steep tariffs it imposed earlier this year on newsprint from Canada, offering at least a partial reprieve to the already beleaguered U.S. newspaper industry, which had struggled to absorb the additional costs."
614,2018-08-02,"Wall Street Journal Pompeo, in Asia, to Hold Talks on Turkey, North Korea, Iran Wall Street Journal KUALA LUMPUR—Secretary of State Mike Pompeo began a tour of Southeast Asia on Thursday with a plan to urge allied countries to maintain sanctions pressure agai…"
615,2018-08-02,Turkey’s embattled financial system needs foreign investors. Its plunging currency shows only the bravest are choosing to stick around.
616,2018-08-02,Director of National Intelligence Dan Coats said that Russia’s efforts to disrupt the 2018 U.S. elections were “pervasive” but have so far fallen short of Moscow’s campaign to interfere in the 2016 vote.
617,2018-08-02,"Manafort’s longtime bookkeeper testified that she processed all of the former Trump campaign chief’s personal expenses, but didn’t know about more than a dozen accounts allegedly controlled in Cyprus."
618,2018-08-02,"The Silicon Valley giant became the first U.S.-listed company to surpass $1 trillion in stock-market value, underscoring the iPhone maker’s explosive growth and its role in fueling the rise of the technology industry to the forefront of the global economy."
619,2018-08-02,"President Trump received a new letter from North Korean leader Kim Jong Un, according to the White House, which didn’t disclose its contents but characterized it as the next step in negotiations over North Korea’s nuclear arsenal."
620,2018-08-02,"Though commonly associated with TV’s goofiest castaway, the always-functional bucket hat is back in fashion as a summer cap"
621,2018-08-02,Wall Street Journal Turkey Needs Foreign Funds as Short-Term Debt Looms Wall Street Journal Turkey's embattled financial system needs foreign investors. Its plunging currency shows only the bravest are choosing to stick around. Turkey has one of the biggest p…
622,2018-08-02,"At Chippewa Valley Bean Co. in Wisconsin, export orders dried up after the EU imposed tariffs in retaliation for America’s on steel and aluminum. The ripples are reaching U.S. vendors and farmers, while in Europe, some bean buyers are looking elsewhere for su…"
623,2018-08-02,Specialty retailer Brookstone files for bankruptcy protection and says it will close its 101 mall-based stores.
624,2018-08-02,"To subscribe to the newsletter, please sign up here MUST READS BOE Raises Interest Rates to Highest Level Since 2009: The Bank of England raised its benchmark interest rate for only the second time in a decade, as worries over inflation trumped concerns about…"
625,2018-08-02,"Wall Street Journal Tech Stocks Lift S&P 500 Wall Street Journal Shares of technology companies rallied Thursday to lift the S&P 500, even as investors grappled with the Trump administration's threat to deepen its trade spat with China. Tech stocks continued …"
626,2018-08-02,News and analysis from WSJ's Washington bureau
627,2018-08-02,Asian stocks were down sharply today after the Trump administration took a more aggressive stance on its next round of proposed Chinese import tariffs.
628,2018-08-02,"The Trump administration is proposing to freeze fuel-efficiency standards for cars and light trucks in 2020, a move that will ease rules for auto makers and also likely intensify a legal fight with California."
629,2018-08-02,"Google’s development of a censor-friendly mobile search app sent shares of China’s dominant search engine plunging, but analysts cautioned Google still faces hurdles in regaining entry to the country after a tense departure eight years ago."
630,2018-08-02,"China fired back after the Trump administration threatened to double proposed tariffs on $200 billion in Chinese goods, saying it won’t yield to White House pressure."
631,2018-08-02,President Trump is heading to central Ohio to shore up support Saturday for a Republican House candidate who has struggled to raise money and is failing to motivate GOP voters.
