,Date,Description
0,2018-08-29,The departing White House counsel helped remake the judiciary.
1,2018-08-29,Wall Street Journal The Other House Race Wall Street Journal There are two battles under way for control of the U.S. House of Representatives. The first and better known is over which party will have the majority when the 116th Congress meets in January. This…
2,2018-08-29,"Florida’s race for governor will offer the first major test of the Democratic and Republican party bases, both of which are being transformed in the Trump era."
3,2018-08-29,"Plus, more evidence of a strong economy."
4,2018-08-29,Brown-Forman lowered its profit outlook because of the uncertainty and added costs created by recently enacted EU tariffs on U.S. whiskey.
5,2018-08-29,"Mexico and the U.S. have negotiated a side letter to the revamped North American Free Trade Agreement that would soften the blow of possible U.S. national-security tariffs the Trump administration is considering for auto imports, Mexican Economy Minister Ilde…"
6,2018-08-29,"Canadian Foreign Minister Chrystia Freeland said bilateral talks with the Trump administration toward a revamped North American Free Trade Agreement kicked off in earnest Wednesday, and reiterated her optimism about success now that issues related automobiles…"
7,2018-08-29,"As U.S.-Canada trade talks kick off in earnest, Foreign Minister Chrystia Freeland reveals that the two nations already reached an accord on autos."
8,2018-08-29,"This is the web version of the WSJ’s Capital Journal newsletter. You can sign up for daily delivery here. What We’re Watching Primary Races: Results in Florida, Oklahoma and Arizona overnight set the stage for key contests in the fall. Details below. Remember…"
9,2018-08-29,"Turkey’s central bank took steps to undo some of the emergency support it provided to its banks, reviving investor concerns over the nation’s financial stability as the lira continued its slide against the dollar."
10,2018-08-29,"WSJ City is the app that delivers concise, smart news on business and finance for mobile. Download for iPhone or Android. Here’s essential reading on today’s developments. MUST READS FROM WSJ CITY Turkey’s central bank took steps to undo some of the emergency…"
11,2018-08-29,"Blockaded by Mideast neighbors, the emirate deployed an unconventional lobbying campaign to win over an unconventional U.S. president, using a list of friends, associates and well-placed admirers; ‘getting into his head as much as possible.’"
12,2018-08-29,"Wall Street Journal US Stocks Rise as Nafta Talks Proceed Wall Street Journal Gains in technology stocks lifted the S&P 500 Wednesday, putting the index on track for a fourth straight record as investors monitored the latest trade developments. The S&P 500 ad…"
13,2018-08-29,"Members of Congress are pressuring the Trump administration to confront Beijing over the mass roundup of Muslims in internment camps, urging travel and financial sanctions be clamped on senior Chinese officials involved in the detentions."
14,2018-08-29,"Don McGahn, the top attorney in the White House, will leave his post in the coming months, the latest departure of one of President Trump’s senior aides."
15,2018-08-29,"The Office of the Comptroller of the Currency opened public discussion on revamping the Community Reinvestment Act, a step that could impact billions of dollars of lending"
16,2018-08-29,The Justice Department is investigating whether a fugitive Malaysian laundered tens of millions of dollars through two associates and used the funds to pay a legal team including ex-N.J. Gov. Chris Christie and a lawyer who represents President Trump.
17,2018-08-29,The U.S. Justice Department is investigating whether a fugitive Malaysian financier laundered tens of millions of dollars through two associates and used the funds to pay a U.S. legal team that includes former New Jersey Gov. Chris Christie and a lawyer who r…
18,2018-08-29,"Rep. Martha McSally won the Republican Senate primary in Arizona on Tuesday, beating more conservative rivals in another political race that had evolved into a test of loyalty to President Trump."
19,2018-08-29,"What We’re Watching U.S.-Mexico Deal: Canadian Foreign Minister Chrystia Freeland is expected to be in Washington today, and the big question is how Canada responds to the trade agreement announced yesterday. Primary Elections: Arizona and Florida have contes…"
20,2018-08-29,"The four Democratic candidates for New York state attorney general faced off in a debate, in a race largely considered still up for grabs just two weeks before the September primary."
21,2018-08-29,Rep. Ron DeSantis won the Republican gubernatorial primary in Florida on Tuesday after he was catapulted from underdog to victor by an endorsement from President Trump.
22,2018-08-28,"The Trump administration’s new trade deal with Mexico is likely to force some auto makers to rethink their strategy for many Mexican-built models, threatening the country’s role as a go-to producer of lower-priced cars for the U.S. market."
23,2018-08-28,Taxpayers get dunned to pay off farmers hurt by retaliatory tariffs.
24,2018-08-28,Shipments are set to decline by a third as shippers pull back from the Islamic Republic months ahead of a Nov. 4 U.S. deadline.
25,2018-08-28,"The nuclear deal’s proponents say China, Russia and India won’t comply. They’ll have to."
26,2018-08-28,U.S. government hackers will now have greater latitude to deter and answer attacks.
27,2018-08-28,He defended the chamber’s role as his colleagues ceded power to the presidency.
28,2018-08-28,Democrats have always known that Trump’s business was his real vulnerability.
29,2018-08-28,"Defense Secretary Jim Mattis said the U.S. doesn’t plan to suspend any more military exercises with South Korea, as talks continue with the North, but added that no decision had yet been made on conducting another large maneuver next year."
30,2018-08-28,"The Senate voted Tuesday to confirm Columbia University economist Richard Clarida to become Federal Reserve vice chairman, filling a top leadership position ahead of the central bank’s September policy meeting."
31,2018-08-28,"Some top Republican lawmakers are urging Attorney General Jeff Sessions to resist any pressure to quit following criticism from President Trump, and to stay in the job at least through the midterm elections."
32,2018-08-28,Wall Street Journal The Pope and Credibility Wall Street Journal Pope Francis doesn't have to run for re-election and the world's Catholics cannot choose to recall him from office. But given a detailed public allegation last weekend from an archbishop in the …
33,2018-08-28,"A dominant presence in Midtown Manhattan for decades before its closure in 2015, the toy store is coming to life again with a new, 20,000-square-foot Rockefeller Center location."
34,2018-08-28,"Yum China rejects a private buyout offer from a consortium of investors that valued the fast-food restaurant operator at more than $17 billion, according to a person familiar with the matter."
35,2018-08-28,"WSJ City is the app that delivers concise, smart news on business and finance for mobile. Download for iPhone or Android. Here’s essential reading on today’s developments. MUST READS FROM WSJ CITY The provisional trade deal that President Trump has struck wit…"
36,2018-08-28,Treasury Secretary Steven Mnuchin said he is hopeful the U.S. will reach a new trade agreement with Canada but said the administration is prepared to move ahead with a bilateral deal with Mexico to rewrite portions of Nafta.
37,2018-08-28,"The U.S. Labor Department said it is creating an office to help companies comply with regulations before finding they have run afoul of labor laws, which policy watchers called a change in tone from an Obama-era emphasis on enforcement."
38,2018-08-28,"The president on Tuesday morning accused the search engine of elevating critical stories about him, saying that it is a “very serious situation” that will be addressed."
39,2018-08-28,"A top government official provided “incomplete” and “misleading” answers to Congress about President Trump’s personal involvement in discussions about the future of the Federal Bureau of Investigation headquarters, according to a new watchdog report."
40,2018-08-28,"The German government is considering providing emergency financial assistance to Turkey as concerns grow in Berlin that a full-blown economic crisis could destabilize the region, German and European officials said."
41,2018-08-28,A scorching run by two of the best-performing stocks in recent years is turning heads.
42,2018-08-28,Citizens in Iran Are Using the Greenback as Tehran Faces Tightening U.S. Sanctions
43,2018-08-28,"Arizona and Florida have contested primaries for both parties, while Oklahoma Republicans will choose a candidate for governor. The marquee Republican contests are tests of loyalty to President Trump."
44,2018-08-28,A federal judge in Washington state Monday blocked blueprints for 3-D-printed guns from being shared online by a pro-gun group until the matter is resolved in court.
45,2018-08-28,"Prosecutors granting Allen Weisselberg immunity after he testified before a grand jury in the investigation on President Trump’s former lawyer, underscores the critical role accountants and CFOs play in criminal prosecutions."
46,2018-08-28,"A delivery man pulled up to a central Tehran home recently carrying a cardboard box with a warm cheese pizza—and $3,000 in U.S. bills. That is a sign of how the black market in dollars has thrived as the value of Iran’s currency falls and Iranians seek safer …"
47,2018-08-28,"Wall Street Journal Global Stocks Rise as US, Mexico Near Trade Deal Wall Street Journal Global stocks rose Tuesday as the U.S. and Mexico neared a deal to revise the North American Free Trade Agreement, although the proposed pact threatened to leave out Cana…"
48,2018-08-28,"Good Morning! Today’s issue looks at the trade agreement reached between the U.S. and Mexico, the implications for Canada, the role of Congress and of Trump’s son-in-law, and the latitude the U.S. retains to hit imports, for example of newsprint. TRUMP NOTCHE…"
49,2018-08-28,"The bilateral trade deal with Mexico and any subsequent agreement with Canada may create some frictions for companies and consumers, but it is a relief compared to what might have been."
50,2018-08-28,President Trump’s new free trade pact with Mexico helps provide some clarity for auto makers and parts suppliers bracing for the worst.
51,2018-08-27,"Wall Street Journal Kushner and Lighthizer Pressed for Deal Before Mexican President Leaves Office Wall Street Journal WASHINGTON—Months of tensions, threats and volatile trade talks between the U.S. and Mexico ended not with the conventional handshake, but i…"
52,2018-08-27,The revised U.S.-Mexico deal is a political gamble on labor and Democratic votes.
53,2018-08-27,His lawyer says the Steele claims about Michael Cohen are false.
54,2018-08-27,"A top government official provided “incomplete” answers to Congress about President Trump’s involvement in discussions about the future of FBI headquarters, according to a new watchdog report."
55,2018-08-27,Ask the professional hand-wringers: Would you rather be in Iran? Venezuela? China?
56,2018-08-27,Why Sen. Elizabeth Warren’s attempt to bork Judge Brett Kavanaugh will fail.
57,2018-08-27,President Trump’s trade policies hurt American firms and the people who want to buy from them.
58,2018-08-27,The president’s supporters and detractors alike use politics to re-enact old narratives of rebellion.
59,2018-08-27,"Manafort Sought Deal in Next Trial... (Second column, 11th story, link ) Related stories: ROGER STONE: I'LL BE INDICTED... 'Sleeper' case could torpedo Mueller report... CASHIN: Stock market betting on Pence should legal issues take dark turn... Republicans C…"
60,2018-08-27,President Trump is breaking norms by using his pardon power in unconventional ways. WSJ's Shelby Holliday takes a look at what this pattern could mean for Paul Manafort and other associates. Photo: AP
61,2018-08-27,A top student-loan official at the Consumer Financial Protection Bureau resigned and released a letter saying Trump administration officials running the bureau were undermining staff work on enforcement cases.
62,2018-08-27,"Prices for livestock, dairy and other agricultural goods climbed on Monday after the U.S. and Mexico reached a trade agreement, alleviating one source of uncertainty that has dragged on those markets since President Trump’s election."
63,2018-08-27,The ACLU defends ‘core political speech.’
64,2018-08-27,"President Trump announced Monday that officials have finalized a bilateral trade deal between the U.S. and Mexico that would replace Nafta, with Canada possibly joining later pending negotiations. Photo: Getty Images"
65,2018-08-27,"Major U.S. stock indexes crested higher Monday, sending the Nasdaq Composite past the 8000 mark for the first time as trade tensions eased."
66,2018-08-27,"As much of the capital continued mourning the late Republican Sen. John McCain, the White House raised its flag to full staff, drawing criticism from politicians and veterans groups."
67,2018-08-27,President Donald Trump on Monday announced his administration had reached a deal with Mexico on issues that have held up renegotiation of the North American Free Trade Agreement for over a year.
68,2018-08-27,"President Trump upended the GOP when he first ran for office. Since then, he’s dragged the party in his direction, undercutting its traditional policy preferences, with his critics leaving and his favored candidates winning. Some establishment Republicans wor…"
69,2018-08-27,"This is the web version of the WSJ’s Capital Journal newsletter. You can sign up for daily delivery here. What We’re Watching Nafta Talks: A trade deal between the U.S. and Mexico could come at any time, as bilateral talks intensified yesterday to solve some …"
70,2018-08-27,"Wall Street Journal Iran Signs Deal With Syria to Deepen Military Cooperation Wall Street Journal Iran said Monday that it had agreed to a deal to deepen military cooperation with Syria, reaffirming its intention to remain in the country despite moves by the …"
71,2018-08-27,"President Trump’s onetime political guru Steve Bannon has produced a movie, entitled “Trump at War,” to energize the base for the midterms."
72,2018-08-27,Wall Street Journal Mexico-US Nafta Negotiators Signal Confidence After Marathon Sunday Session Wall Street Journal WASHINGON—Trade negotiators from the U.S. and Mexico are set to resume talks Monday morning after they worked late into Sunday evening haggling…
73,2018-08-27,"Nissan Motor said it has started producing its first made-for-China electric car, leading a wave of electric vehicles planned by Japanese makers looking to boost sales in the country."
74,2018-08-27,A top Japanese government banker said China’s industrial strategy is “very dangerous” for democracies because totalitarian nations can ignore their citizens’ privacy and get an edge in new technologies.
75,2018-08-27,Wall Street Journal Canceled Pompeo Trip Tests South's Strategy to Win Over North Korea Wall Street Journal SEOUL—A deadlock in U.S.-North Korea denuclearization talks is prompting South Korea's leader to re-evaluate the pace of his engagement with the North.…
76,2018-08-27,"Wall Street Journal Bad News for US Papers, but Tariffs Are Paying Off for One Rock Capital Wall Street Journal When the Trump administration applied tariffs on imports of newsprint earlier this month, it brushed aside opposition from the Canadian government,…"
77,2018-08-27,"In today’s issue, we distill the key takeways from the Fed’s Jackson Hole conference and bring you up to date on trade."
78,2018-08-27,"John McCain, throughout his career, was a driving force behind the interventionist wing of the Republican Party, a faction that views overseas alliances and troop commitments as a stabilizing force in the world."
79,2018-08-26,"Wall Street Journal Rift Between Trump and McCain Reflects Split Within GOP Wall Street Journal When President Trump was heading to West Virginia to give a speech to the Boy Scouts last summer, aides came to him with an idea: Make a side trip to Arizona to vi…"
80,2018-08-26,"Swagger—popularized by hip hop artists and rappers as shorthand for confidence and style in clothes, cars and dating—is now a catch word for one of the world’s oldest and most powerful bureaucracies."
81,2018-08-26,Democrats increase the chances they’ll nominate a left-winger in 2020.
82,2018-08-26,The Pentagon these days is less protectionist than Commerce.
83,2018-08-26,He saw curtailing pollution as part of his patriotic mission.
84,2018-08-26,"Wall Street Journal Republicans, Save Your Party by Impeaching the President Wall Street Journal As news spread that Michael Cohen's plea deal had all but named President Trump as an unindicted co-conspirator in a federal crime, I thought back to a conversati…"
85,2018-08-26,President Trump’s antagonistic posture towards international institutions at foreign summits this summer soured some European officials on the candidacy of a top Fed official to helm the international Financial Stability Board.
86,2018-08-26,"Wall Street Journal US, Mexico Could Resolve Issues Holding Up Nafta Talks as Early as Monday Wall Street Journal The U.S. and Mexico could reach a bilateral agreement as early as Monday on the key issues holding back a renegotiation of the North American Fre…"
87,2018-08-26,"Without mentioning President Trump by name, central bankers at the Federal Reserve’s annual retreat in Jackson Hole made clear they were concerned about his trade policy."
88,2018-08-26,"Washington awoke Sunday to an outpouring of grief and condolences, as leaders and commentators from both sides of the political aisle paid homage to Sen. John McCain after the Republican lawmaker’s family confirmed his death on Saturday from brain cancer."
89,2018-08-26,"Sen. John McCain’s death touches off questions about who will succeed him, putting the spotlight on Arizona’ Gov. Doug Ducey, who will choose a replacement."
90,2018-08-26,"Wall Street Journal North Korea's 'Money Masters' Hold Keys to Kim's Economic Revival Wall Street Journal The rise of these enterprises in a country whose people once relied on a state distribution system, and the comparative wealth they bring to a business-m…"
91,2018-08-26,"Wall Street Journal Rouhani Suffers Fresh Blow After Iran's Parliament Ousts Economy Minister Wall Street Journal Iran's parliament ousted the country's economy minister Sunday, stepping up an overhaul of President Hassan Rouhani's cabinet amid deep domestic …"
92,2018-08-26,President Trump’s performance in office was approved by 44% of registered voters in a WSJ/NBC News poll taken after Paul Manafort’s conviction and Michael Cohen’s guilty plea.
93,2018-08-26,"John McCain was not a model midshipman. While at the Naval Academy, he earned so many demerits for unsanctioned outings that by graduation he was made to march the equivalent of 17 round trips between Annapolis and the fleshpots of Baltimore."
94,2018-08-26,A federal judge in the District of Columbia struck down provisions of three of President Trump’s executive orders that made it easier to fire federal employees who are deemed to be underperforming.
95,2018-08-26,A Hanoi prison could not shake his faith in American exceptionalism.
96,2018-08-26,"Wall Street Journal Sen. John McCain, Former Presidential Candidate, Once a Prisoner of War, Dies Wall Street Journal Sen. John McCain, an admiral's son whose rebellious streak nearly got him expelled from Annapolis but helped him survive North Vietnamese tor…"
97,2018-08-25,"Dialing back globalization would undermine decades of economic progress around the world, Agustín Carstens, head of the Bank for International Settlements, said at the Jackson Hole symposium for the world’s central bankers."
98,2018-08-25,"Dialing back globalization and increasing protectionism would undermine decades of economic progress around the world, Bank for International Settlements head Agustín Carstens said Saturday."
99,2018-08-25,"The U.S. and Mexico are getting close to reaching a bilateral agreement on key issues holding back a renegotiation of the North American Free Trade Agreement, removing a hurdle to completing a deal that would eventually include Canada, according to people clo…"
100,2018-08-25,"The U.S. and Mexico are getting close to reaching a bilateral agreement on key issues holding back a renegotiation of the North American Free Trade Agreement, removing a hurdle to completing a deal that would eventually include Canada, according to people clo…"
101,2018-08-25,"Wall Street Journal US, Mexico Close to Resolving Issues Holding Up Nafta Talks Wall Street Journal The U.S. and Mexico are getting close to reaching a bilateral agreement on key issues holding back a renegotiation of the North American Free Trade Agreement, …"
102,2018-08-25,"President Trump issued a fresh attack on his attorney general, suggesting in a tweet that Jeff Sessions is allowing the Russia investigation to proceed while permitting “real corruption” to go “untouched.”"
103,2018-08-25,The owner of two partially built nuclear reactors in South Carolina walked away from the project last year because of high costs and delays. Now no one wants to pay for it.
104,2018-08-25,"Hurricane Lane lashed Hawaii with heavy rain Friday, causing flooding, landslides and power outages for thousands, before being downgraded to a tropical storm as winds slowed."
105,2018-08-25,"President Trump has praised tariffs, and he has also declared, “No tariffs, no barriers. That’s the way it should be.” Bob Davis looks at whether that no-tariff objective is serious."
106,2018-08-25,"President Trump predicted that Republican senators will perform well in the midterm elections in November, while conceding that retaining control of the House will be tougher."
107,2018-08-24,"FDA Commissioner Scott Gottlieb on the promise and challenges of biologic drugs, capital risk and ‘regulatory arbitrage’ of generics."
108,2018-08-24,"The threat to Trump is a Democratic Congress, not his Attorney General."
109,2018-08-24,Public unions fund initiatives to raise taxes and kill school choice.
110,2018-08-24,"The U.S. has decided to cut more than $200 million in aid to the Palestinians following a review ordered by the Trump administration, U.S. officials said Friday."
111,2018-08-24,The Journal's weekly guide to the ups and downs of the business world.
112,2018-08-24,Decades-old policy means a Chinese company can ship a product to a U.S. customer for less than it costs an American firm.
113,2018-08-24,The economic costs of a potential Pelosi-Schumer victory.
114,2018-08-24,"A group of Republican senators are moving to defend the Affordable Care Act’s protections for people with pre-existing conditions, putting the lawmakers at odds with the Trump administration ahead of a key court case next month."
115,2018-08-24,"Tariffs on steel and aluminum are driving up the value of shipments of metals being produced domestically, but they have little effect on the quantity being churned out."
116,2018-08-24,President Trump said Secretary of State Mike Pompeo is canceling his trip to North Korea planned for next week due to a lack of progress in nuclear talks with Pyongyang.
117,2018-08-24,"More than two weeks after voting concluded, Republican Troy Balderson was declared the winner of Ohio’s special House election."
118,2018-08-24,Defense and aerospace companies are accelerating plans to develop new types of missiles and satellites in an effort to capitalize on President Trump’s proposed military branch devoted to space warfare.
119,2018-08-24,"Cigna and Express Scripts shareholders overwhelmingly supported Cigna’s $54 billion purchase of the pharmacy-benefit manager, a deal that activist investor Carl Icahn initially sought to block."
120,2018-08-24,"A $100,000 real-estate brokerage fee that was part of former Trump attorney Michael Cohen’s guilty plea came from representing a company owned by a member of the Qatar royal family, according to interviews and real estate documents."
121,2018-08-24,"China is stepping up efforts to stem the yuan’s rapid depreciation, in a policy shift intended to fend off capital flight and blunt U.S. criticism that Beijing is weakening its currency as part of the countries’ trade fight."
122,2018-08-24,"Sen. John McCain will discontinue treatment for brain cancer, his family said, adding the progress of the disease and his advancing age will “render their verdict.”"
123,2018-08-24,"Sen. John McCain will discontinue medical treatment for brain cancer, his family said in a statement on Friday."
124,2018-08-24,"What We’re Watching Trump’s Travels: The president is going to Ohio, where he will visit Nationwide Children’s Hospital, meet with supporters, and speak to the Ohio Republican Party’s state dinner. Jerome Powell: He gives his first speech at the economic symp…"
125,2018-08-24,"Allen Weisselberg, President Trump’s longtime financial gatekeeper, was granted immunity by federal prosecutors for providing information about Michael Cohen in the criminal investigation into hush-money payments."
