,Date,Description
1371,2018-07-06,"News18 Russia's Turn to Its Asian Past Wall Street Journal President Donald Trump's summit with President Vladimir Putin on July 16 will take him to Helsinki, one of Russia's many lost possessions. From Finland to Mongolia, the Russian Empire and then, in som…"
1372,2018-07-06,"Secretary of State Mike Pompeo kicked off talks in North Korea with one of leader Kim Jong Un’s top lieutenants, Gen. Kim Yong Chol, soon after arriving in Pyongyang."
1373,2018-07-06,News and analysis from WSJ's Washington bureau.
1374,2018-07-06,"Palestinians angry over their dysfunctional government and decrepit infrastructure are souring on Mahmoud Abbas, as the U.S. questions the 83-year-old statesman‘s interest in peace talks with Israel."
1375,2018-07-06,Economists try to model the effect tariffs have on the economy but actually believe the impact could be much worse.
1376,2018-07-06,"The U.S. and Chinese tariffs that kicked in on Friday raised costs for companies on both sides of the Pacific, but it was the specter of additional levies ahead that was more worrisome for many in business."
1377,2018-07-06,"The U.S. trade gap contracted in May, reflecting a sharp rise in soybean shipments and other exports and only a modest increase in purchases of foreign-made goods."
1378,2018-07-06,"A daily digest of The Wall Street Journal’s coverage of energy companies, commodity markets and the forces that shape them. Send us tips, suggestions and complaints: EnergyJournal@wsj.com DOUBTS GROW ARAMCO IPO WILL EVER HAPPEN The much-anticipated partial li…"
1379,2018-07-06,The fallout from President Trump’s tariffs and China’s counter tariffs will have the greatest impact on the U.S. counties that voted Trump into office.
1380,2018-07-06,The development signals an increased threat to U.S. and allied forces while raising doubts about the Pyongyang’s pledges to disarm.
1381,2018-07-06,"Wealthy investors are shifting their focus to short-term investments, the cost of investing heads toward zero for some basic portfolios, and high-intensity, low-impact water workouts."
1382,2018-07-06,"Today in Real Time Economics, we look at the start of the U.S.-China trade war and potential fallout across the economy, the Fed's focus on bubbles, and the most important economic report of the month—it's jobs day!"
1383,2018-07-06,"Good morning from the WSJ City desks in London. WSJ City is the app that delivers concise, smart news on business and finance for mobile. Download for iPhone or Android. Here’s essential reading on today’s developments. MUST READS FROM WSJ CITY The US slapped…"
1384,2018-07-06,"President Donald Trump urged his supporters in Montana to back the Republican challenging Democratic Sen. Jon Tester this fall, telling voters in a state he carried by 20 points that Mr. Tester “doesn’t share your values.”"
1385,2018-07-06,"Five former wrestlers said this week that Rep. Jim Jordan was aware of, but didn’t respond to, allegations of sexual misconduct by an Ohio State University team doctor."
1386,2018-07-05,The permanent green government takes out Trump’s deregulator.
1387,2018-07-05,President Donald Trump said he has narrowed his search for a Supreme Court justice to two to four candidates and expects to settle on a nominee this weekend ahead of a prime-time announcement Monday night.
1388,2018-07-05,Minutes from the June meeting show growing worry over trade harm.
1389,2018-07-05,There is no national- security case for auto-import tariffs.
1390,2018-07-05,Lawmakers demand the truth about the origin of the 2016 Trump investigation.
1391,2018-07-05,"Wall Street Journal Expose the Palestinian 'Refugee' Scam Wall Street Journal If President Trump wants to promote peace in the Middle East, his first step should be to declassify a key State Department report that would end the myth of Palestinian “refugees.”…"
1392,2018-07-05,"If she is the nominee, get ready for a vicious anti-Catholic Senate smear campaign."
1393,2018-07-05,The new acting administrator of the Environmental Protection Agency is a former coal and energy lobbyist who has expressed skepticism about the human impact on climate change.
1394,2018-07-05,"Consumers and employees expect companies to voice opinions on hot-button topics, and the world’s largest retailer is weighing in. The strategy risks alienating core customers."
1395,2018-07-05,"Wall Street Journal US, China Prepare for Trade Battle Wall Street Journal WASHINGTON—The U.S. and China are poised at midnight to slap levies on $34 billion of each other's exports, the first tangible shots in a trade battle both sides are girding to keep fi…"
1396,2018-07-05,"The Trump administration is moving dozens of immigrant adults closer to their infants and toddlers to comply with a court order to reunite up to 3,000 children separated from adults as part of the administration’s zero tolerance on unauthorized border crossin…"
1397,2018-07-05,"Environmental Protection Agency Administrator Scott Pruitt has resigned from his post, President Donald Trump said. Mr. Pruitt exits amid a series of allegations over ethics and spending."
1398,2018-07-05,Wall Street Journal Pompeo Heads Back to North Korea Wall Street Journal WASHINGTON—Secretary of State Mike Pompeo headed to North Korea on Thursday for a fourth visit in which he is expected to press the government to deliver on its promises to denuclearize …
1399,2018-07-05,President Donald Trump’s use of Twitter to jawbone the price of oil is in danger of backfiring and nearly did before the OPEC meeting in Vienna.
1400,2018-07-05,"Wall Street Journal Merkel Voices Approval for Efforts to Scrap Car Tariffs Wall Street Journal BERLIN—German Chancellor Angela Merkel on Thursday threw her weight behind back-channel efforts to eliminate car import tariffs, fueling hope of a resolution aimed…"
1401,2018-07-05,President Trump plans to raise the issue of Russia’s “malign activity” in Europe and its efforts to meddle in the 2016 U.S. election in a one-on-one meeting with Russian President Vladimir Putin later this month.
1402,2018-07-05,"President Donald Trump has named Bill Shine, a former Fox News executive as assistant to the president and deputy chief of staff for communications."
1403,2018-07-05,What to watch in Friday's jobs report from the Labor Department.
1404,2018-07-05,Investors should curb their enthusiasm over hopes that the European Union can sign a quick car deal with President Donald Trump. This isn’t how the EU works.
1405,2018-07-05,"ZTE Corp. has named a slate of new top executives, including a new chief executive, a person familiar with the matter said, as the Chinese telecom firm presses ahead with its U.S.-mandated leadership purge."
1406,2018-07-05,News and analysis from the WSJ's Washington bureau.
1407,2018-07-05,Wall Street Journal US Stocks Set to Open Higher as Investors Shrug Off Looming Tariffs Wall Street Journal U.S. stocks were poised to open higher Thursday following gains across Europe as investors looked beyond a looming deadline for tariffs between the U.S…
1408,2018-07-05,Cheese makers that rely on foreign sales are strained as China and Mexico raise tariffs on U.S. mozzarella and provolone.
1409,2018-07-05,"Today in Real Time Economics, we look at the latest developments in the labor market ahead of Friday's U.S. jobs report, China's warning on trade, how global commerce is slowing even before tariffs take effect, the great American cheddar glut, and what to wat…"
1410,2018-07-05,"Good morning from the WSJ City desks in London. WSJ City is the app that delivers concise, smart news on business and finance for mobile. Download for iPhone or Android. Here’s essential reading on today’s developments. MUST READS FROM WSJ CITY The US will sh…"
1411,2018-07-05,"Planned U.S. tariffs on Chinese products will hurt companies around the globe as $20 billion of the $34 billion in goods targeted are made by foreign companies in China, Chinese officials said."
1412,2018-07-05,"The company’s new CEO is Xu Ziyang, the former head of the company’s business in Germany. ZTE also named a new chief financial officer, as well as a new chief technology officer."
1413,2018-07-04,"Wall Street Journal Houston, We Have a Space Force Wall Street Journal For most Presidents an event about space regulation wouldn't produce headline news, but then there's President Trump. At such an event last month Mr. Trump ordered the Pentagon to develop …"
1414,2018-07-04,"The international system for resolving trade disputes will come under increasing threat if leading economies continue to ramp up the pace at which they impose new restrictions on imports, the World Trade Organization warned."
1415,2018-07-04,Economic nationalism is a threat to world-wide—and American—prosperity.
1416,2018-07-04,Liberals are hysterical because a long era of judge-made law may be about to end.
1417,2018-07-04,"Wall Street Journal Can Trump and Europe Cut a Deal? Wall Street Journal Each July 4 when I was growing up, my family would read the Declaration of Independence—or at least its stirring opening verses—from a framed copy that I still have. In recent years I've…"
1418,2018-07-04,"WSJ City is the app that delivers concise, smart news on business and finance for mobile. Download for iPhone or Android. Here’s essential reading on today’s developments. New data suggests that global export growth, strong in 2017, has slowed to a relative c…"
1419,2018-07-04,"Trump will host a campaign rally in Montana on Thursday in an effort to corral his supporters behind Matt Rosendale, the Republican state auditor who hopes to quash Democratic Sen. John Tester’s hopes for a third term."
1420,2018-07-04,The debate over whether Google and Facebook are too big usually centers on whether they suppress competition for goods and services. A potentially more troubling possibility: that they sap competition for values and ideas.
1421,2018-07-04,"Wall Street Journal China Pulls Plan to Impose Tariffs on US Goods First Wall Street Journal BEIJING—As U.S. and China gear up to slap each other with tariffs, an unexpected question is confounding the Chinese leadership: Who gets to strike first? In response…"
1422,2018-07-04,"To subscribe to the newsletter, please sign up here MUST READS NATO Allies Hope for Harmony, Fear Trump Ahead of Summit: U.S. and allied officials are working hard to choreograph a NATO meeting next week that would be a tableau of unity, and show that the 29-…"
1423,2018-07-04,"Wall Street Journal The Trade Slowdown Investors Fear Has Already Arrived Wall Street Journal Even before a round of U.S. tariffs levied on China comes into force Friday, there are signs that the long-feared slowdown in global trade is under way. Business sur…"
1424,2018-07-04,"Cree, a U.S. maker of lighting products, tried to convince the Trump administration that paying tariffs on its goods coming out of China would threaten its spending on research and jobs in the U.S. It didn’t work."
1425,2018-07-04,"Wall Street Journal How Russia Gave Itself a Facelift for the World Cup Wall Street Journal When U.S. national security adviser John Bolton sat down with Vladimir Putin at the Kremlin last week, to calm the highest tensions between nuclear superpowers in at l…"
1426,2018-07-04,"The European Union’s first populist leader, Silvio Berlusconi, has become a forgotten man in Italian politics, displaced by a new antiestablishment wave."
1427,2018-07-04,Immigrants separated from their children after being arrested for illegally entering the U.S. at the Mexican border are being asked to choose between being deported alone or with their children.
1428,2018-07-04,A bitter primary runoff for governor is dividing Georgia’s dominant Republican Party as it prepares to face a well-funded Democratic opponent in the general election.
1429,2018-07-04,A Guatemalan mother who had been detained and separated from her three children when she crossed the U.S. border more than a month ago was reunited with them in New York City on Tuesday.
1430,2018-07-04,"Wall Street Journal Trump Weighs Personal Chemistry, Legal Record in Picking Supreme Court Nominee Wall Street Journal WASHINGTON—President Donald Trump is balancing potential Supreme Court nominees' political attractiveness, legal record and personal chemist…"
1431,2018-07-04,"Good morning from the WSJ City desks in London. WSJ City is the app that delivers concise, smart news on business and finance for mobile. Download for iPhone or Android. Here’s essential reading on today’s developments. MUST READS FROM WSJ CITY US and allied …"
1432,2018-07-03,"Wall Street Journal NATO Allies Hope for Harmony, Fear Trump Ahead of Summit Wall Street Journal U.S. and allied officials are working hard to choreograph a NATO meeting next week that would be a tableau of unity, and show that the 29-member alliance is fight…"
1433,2018-07-03,"Utah Sen. Mike Lee, who has indicated his openness to being nominated to the Supreme Court, was interviewed by President Donald Trump by telephone about the post, his office said."
1434,2018-07-03,The New York Times has reassigned a national-security reporter whose phone and email records were seized by federal prosecutors investigating a Senate Intelligence Committee staffer with whom she had earlier been involved in a relationship.
1435,2018-07-03,"A fund controlled by the Gulf state of Qatar has acquired full ownership of New York’s famed Plaza Hotel, featured in “The Great Gatsby” and “North by Northwest,” for about $600 million."
1436,2018-07-03,"U.S. auto sales have proved resilient so far in 2018, with many of the largest car sellers posting sales increases. GM, reporting sales for the first time on a quarterly basis, said sales were up 4.6%."
1437,2018-07-03,Bonds from the Tennessee Valley Authority briefly spiked lower late last month after the Trump administration mentioned the utility in a plan to revamp government agencies.
1438,2018-07-03,President Donald Trump ordered flags lowered across the country in memory of five people killed in last week’s shooting at the Capital Gazette newspaper. The proclamation comes after criticism from Annapolis mayor.
1439,2018-07-03,"To subscribe to the newsletter, please sign up here MUST READS Merkel’s Bid to Avert Government Collapse Could Hit Another Bump: Angela Merkel’s fight to secure her shaky coalition faced a new hurdle on Tuesday as the German chancellor moved to persuade her c…"
1440,2018-07-03,"The Trump administration is planning to rescind Tuesday a set of Obama-era policies that encourage the use of race in college admissions to promote diverse educational settings, according to two people familiar with the plans."
1441,2018-07-03,Germany’s role as an anchor for Europe makes its export engine a risk for the continent.
1442,2018-07-03,News and analysis from the WSJ's Washington bureau.
1443,2018-07-03,The Trump administration is planning to rescind a set of Obama-era policy documents that encourage the use of race in college admissions to promote diverse educational settings.
1444,2018-07-03,"China’s customs agency unexpectedly issued trade data that showed growth in exports to the U.S. slowing, though analysts dismissed the figures as part of Beijing’s messaging campaign in its tariff battle with Washington."
1445,2018-07-03,"Less than two months after its unveiling, President Trump’s plan to lower prescription drug prices is up for a big test."
1446,2018-07-03,"Russian oil companies are priming the pumps to significantly boost crude output this summer following an OPEC agreement, taking on an unusually important role in a global effort to keep prices in check."
1447,2018-07-03,"Today in Real Time Economics, we look at China's plunging currency, suffering in the Farm Belt, a bump in factory activity, a reprieve for Germany's governing coalition, more misery in strip malls, and happy news for students—a strong labor market is squeezin…"
1448,2018-07-03,"Good morning from the WSJ City desks in London. WSJ City is the app that delivers concise, smart news on business and finance for mobile. Download for iPhone or Android. Here’s essential reading on today’s developments. MUST READS FROM WSJ CITY Germany’s gove…"
1449,2018-07-03,Fed officials gave Goldman Sachs and Morgan Stanley an unprecedented option in stress tests that allowed them to keep shareholder payouts at recent levels without a formal failing grade—despite failing a part of the test. It’s being seen across Wall Street as…
1450,2018-07-03,A federal judge on Monday ruled the Trump administration can’t systematically detain asylum seekers who arrive at the border with a credible fear of returning to their homelands.
1451,2018-07-03,Andres Manuel López Obrador’s election victory offers the chance to reset frayed relations with Washington as the incoming Mexican president and President Trump both believe the North American Free Trade Agreement needs to be rewritten.
1452,2018-07-02,Why Roe v. Wade and same-sex marriage are likely to survive after Kennedy.
1453,2018-07-02,The financial markets are watching Mexico’s new president.
1454,2018-07-02,Americans are buying more boats and manufacturing more of just about everything.
1455,2018-07-02,The Supreme Court is the Democrats’ preferred legislature for social issues.
1456,2018-07-02,Our institutions show an unrivaled capacity for weathering disruptive change.
1457,2018-07-02,"Avis, Home Depot and even Donald Trump want free feedback."
1458,2018-07-02,"He faithfully applies the Constitution, and his dissents have already influenced the high court."
1459,2018-07-02,"Calls to abolish the Immigration and Customs Enforcement agency are opening divisions among Democrats, with some arguing it will appeal to their base and others saying the issue could hurt in swing districts."
1460,2018-07-02,Even Bernie Sanders has said not-unkind things about the president.
1461,2018-07-02,"Secretary of State Mike Pompeo on Thursday will leave for North Korea to engage in the first high-level talks on eliminating Pyongyang’s nuclear weapons and programs since the Singapore summit in June, U.S. officials said."
1462,2018-07-02,"Though John Roberts has been chief justice of the for 13 years, this fall’s Supreme Court term may see the true birth of the Roberts Court as he becomes the new man in the ideological middle."
1463,2018-07-02,The veteran investigative reporter was suspended in December for a story concerning President Trump’s former national security adviser Michael Flynn.
1464,2018-07-02,"Wall Street Journal Mexico Vote Snubs the Political Establishment Wall Street Journal MEXICO CITY—Mexico's election was a tsunami for the country's traditional parties, which suffered unprecedented setbacks at the hands of Andrés Manuel López Obrador and the …"
1465,2018-07-02,"Wall Street Journal Four Arrested in Alleged Plot to Bomb Anti-Iran Gathering Wall Street Journal PARIS—European security services arrested four people, including an Iranian diplomat, for allegedly planning to bomb an annual gathering of Iranian opposition gr…"
1466,2018-07-02,"Wall Street Journal US to Consider Iran Sanctions Relief on a 'Case-by-Case' Basis Wall Street Journal WASHINGTON—The Trump administration will consider requests for waivers from economic sanctions against Iran on a “case-by-case” basis, a senior State Depart…"
1467,2018-07-02,The Trump administration’s new push for more federal detention facilities for immigrants awaiting asylum hearings or deportation has brightened the outlook for the country’s two largest private prison operators.
1468,2018-07-02,A dedicated team is coming together from across the government to help select and push through a nominee who could set a new direction for the court on abortion rights and other issues.
1469,2018-07-02,"Wall Street Journal Win by López Obrador Pushes Mexico Sharply to Left Wall Street Journal MEXICO CITY— Andrés Manuel López Obrador, a divisive former Mexico City mayor who vowed to upend Mexico's corrupt status quo, cruised to the biggest win in nearly four …"
1470,2018-07-02,German Chancellor Angela Merkel was set to make one last attempt to stop her conservative bloc from rupturing over immigration and avert a collapse of her coalition government.
1471,2018-07-02,"To subscribe to the newsletter, please sign up here MUST READS Merkel’s Last-Ditch Fight to Save Her Government: Germany has entered uncharted territory and its captain is navigating by sight. Chancellor Angela Merkel and her estranged interior minister were …"
1472,2018-07-02,"Among the companies with shares expected to trade actively in Monday's session are General Motors, Ford, Tesla, Dell Technologies, Facebook and Target."
1473,2018-07-02,"Important as civility in public life is, something even more important appears to be imperiled in today’s charged political climate: faith in democracy itself."
1474,2018-07-02,Two instances of bipartisanship in Congress in recent weeks offer clues about what Democrats and Republicans can agree on in today’s Washington.
1475,2018-07-02,Connecticut’s Democratic voters have a stark choice to make in August’s gubernatorial primary as the choose between a wealthy businessman and a convicted felon.
1476,2018-07-02,The World May Not Have More Oil to Give
1477,2018-07-02,"The U.S. Farm Belt helped deliver Donald Trump to the White House, drawn to his promises to revive rural America and deregulate industry. Now, the president’s global trade offensive is threatening the livelihoods of many farmers."
1478,2018-07-02,The impact of U.S. sanctions against billionaire Oleg Deripaska and his Rusal aluminum empire has trickled down to Siberia’s working class.
1479,2018-07-02,"Today in Real Time Economics, we look at the U.S. economic expansion on its ninth birthday, a subtle Trump warning for the Fed, the automotive industry as collateral damage in the U.S. trade fight, Mexico's presidential election, and all the signs that inflat…"
1480,2018-07-02,"Wall Street Journal Mexican Election Could Accelerate Nafta Talks Wall Street Journal The Mexican presidential election on Sunday removes a hurdle to the renegotiation of the North American Free Trade Agreement, raising the likelihood that the 24-year-old tre…"
1481,2018-07-02,"Wall Street Journal Stocks Start the Quarter With Losses as Trade Tensions Heat Up Wall Street Journal Global stocks started the quarter with steep declines as escalating trade rhetoric, concerns about the German government and a downbeat economic reading fro…"
1482,2018-07-02,"Good morning from the WSJ City desks in London. WSJ City is the app that delivers concise, smart news on business and finance for mobile. Download for iPhone or Android. Here’s essential reading on today’s developments. MUST READS FROM WSJ CITY is back on the…"
1483,2018-07-02,China has yet to really deploy one of its most effective means of economic blackmail.
1484,2018-07-02,"With the U.S out of the Iran nuclear agreement, the Trump administration is stamping down on the Iranian regime. The Wall Street Journal's Gerald F. Seib explains the sources of pressure. Photo: Reuters"
1485,2018-07-02,López Obrador’s victory ends a reform era and brings new uncertainty.
1486,2018-07-01,"Wall Street Journal North Korea Expands Key Missile-Manufacturing Plant Wall Street Journal SEOUL—North Korea is completing a major expansion of a key missile-manufacturing plant, said researchers who have examined new satellite imagery of the site the latest…"
1487,2018-07-01,Wall Street Journal Bolton Says Removing Iran From Syria Trumps Deposing Assad Wall Street Journal WASHINGTON—National-security adviser John Bolton said Syrian President Bashar al-Assad's hold on power wasn't a strategic issue for the U.S. and that President …
1488,2018-07-01,Troubling new evidence that Kim Jong Un isn’t honoring his promises.
1489,2018-07-01,"The U.S. economy has just completed one of its strongest quarters of this expansion, bouncing back from a modest first quarter. But economists warn that output is likely outpacing the economy’s long-run capacity for growth."
1490,2018-07-01,"Leonard Leo, a leader in the Federalist Society, again will push for an unflinching conservative for the court—this time, to succeed retiring Justice Anthony Kennedy—and President Donald Trump is expected to pay heed."
1491,2018-07-01,"A top Republican fundraiser said he would stop making payments to a former mistress who signed a hush-money agreement that was negotiated last year by Michael Cohen, President Trump’s longtime lawyer."
1492,2018-07-01,"Wall Street Journal To Head Off Rising Crude Prices, It May Take More Than Calls for More Oil Wall Street Journal President Donald Trump's request for more Saudi Arabian oil put a spotlight on growing U.S. unease about how quickly the crude sector has switche…"
1493,2018-07-01,The family remains in jeopardy thanks to a U.S.-funded rogue U.N. agency.
1494,2018-07-01,U.S. sanctions and Saudi production are a potent combination.
1495,2018-07-01,Wall Street Journal New Unrest Roils Iran as US Ramps Up Pressure Wall Street Journal Spreading unrest in Iran raises the prospect of broader antigovernment protests as the political leadership in Tehran faces mounting pressure from a Trump administration eff…
1496,2018-07-01,"President Donald Trump said in an interview broadcast Sunday that the legality of abortion could be decided by the states as a possible fallout from filling a Supreme Court opening, a statement that acknowledges the high stakes of the battle over Justice Anth…"
